Subreddit,Caption
Nude_Selfie,I know I’d get a dick pic if I sent this to you 😜
Nude_Selfie,Could I have real opinions on my petite body
Nude_Selfie,"Born in 1985, are you brave enough to creampie me?"
Nude_Selfie,Hey (f)
Nude_Selfie,Petite slut ready for a fuck😈😈
Nude_Selfie,My morning selfies before college
Nude_Selfie,Felt embarrassed posting but what are your thoughts on my body
Nude_Selfie,It was my 18th birthday not to long ago
Nude_Selfie,do u prefer small cute nipples or big puffy ones?
Nude_Selfie,"if you find me attractive, i owe you a pussy pic ;)"
Nude_Selfie,Rate my body out of 10
Nude_Selfie,"Suck my tits and I will suck your dick!!! Single and horny AF, [F] 18"
ass,I just turned 40f; You would still hit it
ass,Your breakfast in bed
ass,Insert 4 inches to play ;)
ass,First nude since I got to Hawaii…
ass,Just looking for something to eat
ass,Do you think my nerd butt is cute?
ass,Sometimes all you need is a woman with a big ass to bounce on your lap
ass,I need a friend that will eat my ass without question when I bend over
ass,42 yr old mom getting naughty in the women’s room
ass,I think it's a little hard not to go balls deep after an invitation like this
ass,I just turned 40f; You would still hit it
ass,I wanna feel your face cheeks in between my butt cheeks
ButtsAndBareFeet,Are you a married man looking at my nudes? Y or N
ButtsAndBareFeet,"Anal on the first date, Y or N?"
ButtsAndBareFeet,What are you tasting first?
ButtsAndBareFeet,Me after our first date
ButtsAndBareFeet,"Pound my ass, or GTA 6?"
ButtsAndBareFeet,"Where are you starting, my butt or feet?"
ButtsAndBareFeet,What do you call a girl that offers anal on the first date?
ButtsAndBareFeet,"If I asked you to fuck my asshole on a first date, what would your answer be?"
ButtsAndBareFeet,How do I tell a guy i want him to suck my feet?
ButtsAndBareFeet,If you fucked me… where would you finish?
ButtsAndBareFeet,How should I tell a guy I have a foot fetish?
ButtsAndBareFeet,let my soft booty entice you
girlsinyogapants,"Yes, that’s a real pocket :)"
girlsinyogapants,sunday jerk material 🩵
girlsinyogapants,I know where you looked first!
girlsinyogapants,Nothing like a simple pair of black leggings
girlsinyogapants,These are my (sex) adventure shorts
girlsinyogapants,Nothing like a simple pair of black leggings
girlsinyogapants,Not the biggest or most bubbly ass.. but hopefully you like staring at it
girlsinyogapants,i like the fact these shorts are a little bit see through
girlsinyogapants,"got some new yoga shorts, how do they look? ♥️"
girlsinyogapants,trying a different way of showing you my yoga pants ;)
girlsinyogapants,Perfectly highlighting all my curves
girlsinyogapants,The perfect gym fit
STAWG,I probably deserve a spanking
STAWG,Am I curvy enough for a 4'9 girl?
STAWG,ever fuck a thick texan girl?
STAWG,I have to be careful or my pants fall down
STAWG,what's more important booty shape or size?
STAWG,who wants my juicy ass all in their face?
STAWG,Smack my ass and tell me im a good girl
STAWG,Your favorite thick white girl
STAWG,I’m gonna use your face as a chair and you’ll love it
STAWG,"If you aren't an ass guy yet, I hope this helps!"
STAWG,How do I get older guys to notice me? 18F
STAWG,"Guys my age seem to only care about ass, do older guys like me for my boobies?"
BigBootyPorn,this is barely a swimsuit 😳
BigBootyPorn,Sunday is for ass worship
BigBootyPorn,ever had a soccer mom with phat ass smothering your face?
BigBootyPorn,I think your face and my ass should have a play date. What do you say?
BigBootyPorn,42 yr old mom and a proud owner of this juicy ass
BigBootyPorn,I want to ride you like this!
BigBootyPorn,I love turning my panties into thongs
BigBootyPorn,42 yr old mom with a fluffy bubble ass
BigBootyPorn,Eat my big peach
BigBootyPorn,"it jiggles so much, can you imagine the backshots"
BigBootyPorn,just look at the way it grips...
BigBootyPorn,my asshole is ready for penetration
pawg,You better hope I don’t sit on you
pawg,the way my ass swallowed up my panty was smooth like butter
pawg,hoping you're a fan of mirror pics 😇
pawg,"A little bit of cellulite is okay with you, right? 😇"
pawg,Only 19 years old but I think it's pretty big
pawg,Did I catch your attention?
pawg,Did someone called Mewtwo?
pawg,Mom of two with the house to myself
pawg,I’m tiny but my ass isn’t
pawg,how's my shape?
pawg,I grew it myself!
pawg,More than you could handle
bigasses,Only 18 years old but I think it's pretty big 🤩
bigasses,I’m never too busy to show you my ass
bigasses,Yes you can absolutely slap it
bigasses,Ass twice as wide as my waist 😳
bigasses,I'm just a mom in my 40's trying to keep up with girls half my age
bigasses,Imagine it jiggle on your cock
bigasses,Getting ready to sit on your face or your cock?
bigasses,Booty moving like jello
bigasses,"if my pussy isn't enough, you can feed on my ass"
bigasses,Can I clap it on your stick ?
bigasses,Let me park this ass right on your face
bigasses,If I bounce it in your face you have to eat it. Sorry I don’t make the rules
booty,I got 2 rules. No condoms. Fill my ass
booty,This booty deserves a nice hard slap
booty,ever tasted a brazilian girl's asshole?
booty,We would fuck 3 times a day if you came on vacation with me
booty,Is my butt nice for 18?
booty,I think I know where all of my extra weight went
booty,I kinda wanna lose my anal virginity now that I'm 18
booty,Do you eat it before you fuck it? Be honest
booty,Would you let a 92 pound girl sit on your face?
booty,Face first or dick first
booty,Is it big enough for older guys to notice me?
booty,Bent over and ready to take it from you daddy
WideHipsNSFW,My hips at 19 vs 40
WideHipsNSFW,Wide hips sexy tits and a fat ass (f)
WideHipsNSFW,Sexy wide hips (f) ass so fat you can see it from the front
WideHipsNSFW,5’1 with wide hips
WideHipsNSFW,"Wide hips and small tits, do you like it?"
WideHipsNSFW,do you find my hips wide enough for a 19yo?
WideHipsNSFW,hips like a pear or an hour glass?
WideHipsNSFW,nice hips and perfect soft boobies
WideHipsNSFW,My big tits and hips makes my waist seem smaller
WideHipsNSFW,they told me im blessed with my hourglass wide hips figure
WideHipsNSFW,big boobs wide hips tiny waist all for you
WideHipsNSFW,these hips are hiding a sweet treat hehe
PawgLove,Do older guys like my bodytype? 18F
PawgLove,Would you try e-girl butt?
PawgLove,have you ever dumped ur load inside a texan girl?
PawgLove,Grab my ass
PawgLove,I want you to get me pregnant from some hot doggy style
PawgLove,Let's have sex in the bath
PawgLove,can you bend me over everyday after work?
PawgLove,Would you date me even tho my tits are too big for my 4'9 body? [F18]
PawgLove,fuck me on the first date?
PawgLove,is my ass too big?
PawgLove,"I love sending nudes to random men, you in?"
PawgLove,Can I convince you to eat my asshole?
ThickThighs,"I’ll spread it, you fuck it"
ThickThighs,Say yes if you’re over 19 and I’ll send you something?
ThickThighs,May I send you more nudes? Yes or no
ThickThighs,I want to fuck a redditor soon.. which state are you in? F43
ThickThighs,i wonder if your face could handle this much booty
ThickThighs,How long would you last behind this thick ass
ThickThighs,Would you eat it or just fuck it?🙈
ThickThighs,I want you to bury your face in this thick ass
ThickThighs,You went to shower and found me in this position. Your next move?
ThickThighs,I want to fuck a redditor soon.. which state are you in? F43
ThickThighs,Describe my body in one word
ThickThighs,Comment your age if were fucking...? (F19)
TwerkQueens,"You jerk, I’ll twerk ;)"
TwerkQueens,"You jerk, I’ll twerk ;)"
TwerkQueens,"Taking Viagra out o f business, Twerk Challange Accepted"
TwerkQueens,"You jerk, I’ll twerk ;)"
TwerkQueens,Training to twerk so I can do it on your cock later
TwerkQueens,Shaking my ass for you (twerk)
TwerkQueens,I love it when you stare on my Ass while I twerk
TwerkQueens,Nerdy Latinas hidden the best asses [twerk]
TwerkQueens,Use my ass to keep your cock warm when I twerk
TwerkQueens,an ass made to twerk on your dick
TwerkQueens,Twerk is the only way to wake you up!
TwerkQueens,May I twerk on your cock like this sir ;)
HungryButts,I want you to stick it in and just let it marinate for a minute
HungryButts,Fuck me in the ass😈
HungryButts,come bite this juicy ass
HungryButts,my ass looks better when is bouncing on you
HungryButts,"Small waist, big ass 😍"
HungryButts,are you getting hard if i bend over on our first date?
HungryButts,I think white is my color wanna add some more ;)
HungryButts,Spank me with your cock and I'll tattoo that on my ass
HungryButts,My ass completely swallows this thong
HungryButts,how about u taste my peach after a long day at work?
HungryButts,Come over and eat this juicy ass
HungryButts,"My butt is always hungry,"
ThickChixxx,Just turned 18 and my ass didn't grow yet... is it too small for you?
ThickChixxx,Would you let a thick girl like me to give you the best tittyfuck?
ThickChixxx,would u like to taste my holes?
ThickChixxx,Would you date me even if I’m a bit chubby?
ThickChixxx,Too thick or just right?
ThickChixxx,Do you think my body type is attractive even though I’m chubby?
ThickChixxx,Would you play with my boobs even tho i’m only 4’9 small? [F18]
ThickChixxx,I love sharing nudes with random dudes... are you in?
ThickChixxx,can i wake you up by sitting on your face?
ThickChixxx,front or back? what would you choose ;)
ThickChixxx,too thick or just right?
ThickChixxx,Ever been with a thick latina?
BiggerThanYouThought,Thinking I should flash the neighborhood dads my DDs when I catch them staring
BiggerThanYouThought,You can cum in my vault anytime ;)
BiggerThanYouThought,I think my tits could be considered legendary loot
BiggerThanYouThought,"5’3, 21 years old and massive tits :)"
BiggerThanYouThought,I wear this shirt and nobody can tell
BiggerThanYouThought,Natural airbags (OC)
BiggerThanYouThought,My pajamas don’t show off much!
BiggerThanYouThought,Surprising everyone at the beach with my big natural tits (OC)
BiggerThanYouThought,Big milkers hidden under a tiny top (OC)
BiggerThanYouThought,they’re a little more than a handful ;)
BiggerThanYouThought,Big and milky
BiggerThanYouThought,Here’s what’s under my gym fit
PerfectBody,"I wanna send nudes to random men, leave a 🤍 if you're in"
PerfectBody,"I wanna send nudes to random men, leave a 🤍 if you're in"
PerfectBody,Trying to brighten up your feed 😀
PerfectBody,Can i turn you on today?
PerfectBody,It turns me on so much to show off my body for anyone to see!
PerfectBody,Pussy eaters are my type
PerfectBody,"I wanna send nudes to random men, leave a ❤️ if you're in"
PerfectBody,I need tips on getting older guys
PerfectBody,"I wanna send nudes to random men, leave a 🤍 if you're in"
PerfectBody,"If you'd accept me sitting in your face with no questions, drop a ❤️"
PerfectBody,Are we perfect from behind?
PerfectBody,I love doing this in public
BreedingMaterial,You can finish inside
BreedingMaterial,"When you breed a goth girl, you make baby bats."
BreedingMaterial,Petite and ready to be pregnant 🥹
BreedingMaterial,Time to make mixed babies
BreedingMaterial,Need a guy brave enough to cream pie me at work
BreedingMaterial,I'll wrap my legs around you as you cum to prevent any spillage 🙈
BreedingMaterial,Tuesday nights are for making babies…every night is actually 😝
BreedingMaterial,This body was made for cream pies.
BreedingMaterial,I’m positioned so that your cum will get deep inside ☺️
BreedingMaterial,It’s my birthday tomorrow and all I want is to be pregnant
BreedingMaterial,Ready to be a tiny milf in 2024
BreedingMaterial,"""Fuck me on the first date"" kind of dress"
WhiteCheeks,Bury your face in it
WhiteCheeks,I’d love for your face to be buried between my cheeks :)
WhiteCheeks,doesn’t matter the age if he eats ass
WhiteCheeks,One small step for man…
WhiteCheeks,A MILF getting you a snack.
WhiteCheeks,everyone can use some more white cheeks in their life
WhiteCheeks,ever been smothered by a pair of cheeks
WhiteCheeks,I hope you don’t mind a few stretch marks 23F
WhiteCheeks,Panties on a side are so underrated
WhiteCheeks,Sunday's are meant for clapping cheeks
WhiteCheeks,there's plenty to plant your face in right here
WhiteCheeks,"We ain't always gotta Rush, We can take it Slow"
Break_Yo_Dick_Thick,ready to milk your dick ;)
Break_Yo_Dick_Thick,i know you’d love me on your dick
Break_Yo_Dick_Thick,"My cute ass is ready to break some dick, any volunteer?"
Break_Yo_Dick_Thick,I’m slim everywhere except in one area!
Break_Yo_Dick_Thick,Always happy when I’m sharing my thick body
Break_Yo_Dick_Thick,The lingerie stays on
Break_Yo_Dick_Thick,Would you actually try anal with a thick ass nurse like me?
Break_Yo_Dick_Thick,Can your cock handle 3 thick girls at the same time?
Break_Yo_Dick_Thick,do you think i'd break it
Break_Yo_Dick_Thick,ever pounded this much booty?
Break_Yo_Dick_Thick,"If I was your wife, you wouldn't mind if I'd break your cock with my peaches right?"
Break_Yo_Dick_Thick,death by snu snu
MassiveTitsnAss,Slow motion drop…
MassiveTitsnAss,"would you fuck me if i was like this in front of you, yes or no?"
MassiveTitsnAss,JJ's 😏
MassiveTitsnAss,Fuck my pussy in this truck stop… yay or nay
MassiveTitsnAss,"Would you fuck me if you caught me taking this pic, yay or nay?"
MassiveTitsnAss,Would you fuck me if you caught me taking selfies in the gym?
MassiveTitsnAss,"Massive enough, yeah?"
MassiveTitsnAss,Blessed by the titty gods
MassiveTitsnAss,hope girls that can suck their own tits turn you on
MassiveTitsnAss,Huge boobs on a small frame... Hot or not?
MassiveTitsnAss,do i have the kind of booty you'd bury your cock in?
MassiveTitsnAss,"I heard you like thick girls with big boobs, is it true?"
MixedRaceGirls,im Indian and Maori
MixedRaceGirls,Chinese x White(Polish)
MixedRaceGirls,Cuban \ Lebanese
MixedRaceGirls,Chinese x Argentinian
MixedRaceGirls,Peruvian x Asian x Italian
MixedRaceGirls,Peruvian x Asian x Italian
MixedRaceGirls,Japanese x Portugese
MixedRaceGirls,Czech X Brazilian
MixedRaceGirls,Thoughts on Filipina x Hawaiian girls?
MixedRaceGirls,Brazilian x Czech
MixedRaceGirls,Peruvian x Italian x Asian
MixedRaceGirls,Korean x Caucasian
assinthong,Tiny thong vs phat cheeks
assinthong,the kind of thongs that barely cover up anything are my favorite
assinthong,"The tinier the thong, the better"
assinthong,"Your baby girl is waiting, ready to heat things up"
assinthong,Thong reveal
assinthong,The recoil is everything
assinthong,I swear there’s a thong in there somewhere
assinthong,"So much ass, so little thong"
assinthong,Thick from the back and front
assinthong,I took this pic so if your girl catches you looking you can say it’s art
assinthong,Today is for lilac thongs <3
assinthong,Just wanted to show you my ass
cellulite_gw,Cellulite makes every ass look even better! Don’t you agree?
cellulite_gw,hope my cellulite doesn’t ruin my big booty
cellulite_gw,Cellulite is really just glorious ass dimples 😊 Don’t you agree?
cellulite_gw,I struggle to accept my cellulite. I'm having a hard time believing anyone would love this. Thoughts??
cellulite_gw,Feeling my new swimsuit
cellulite_gw,Cellulite on a milf ass just makes it even more fuckable. Don’t you agree?
cellulite_gw,Cellulite just makes it look even better😊 Don’t you agree?
cellulite_gw,My dimples in motion
cellulite_gw,Are you into natural teens with cellulite?
cellulite_gw,Would you use a married curvy teacher mom with a big ass?
cellulite_gw,Cellulite is really just glorious ass dimples 😊 Don’t you agree?
cellulite_gw,40yr old mom tanning my big fat ass and thighs
slightcellulite,I think the cellulite makes it look even better!
slightcellulite,we <3 texture
slightcellulite,Just your everyday milf with a fat cellulite covered ass looking to be embraced
slightcellulite,I knead to be loved on.....
slightcellulite,soft cheeks in motion
slightcellulite,She's Texas Size
slightcellulite,I love my green dress...........
slightcellulite,cellulite is so pretty 🥰
slightcellulite,I’m trying to think of a better combo than a fat ass and cellulite
slightcellulite,Pillow humping really brings out my cellulite : )
slightcellulite,I love short tight dresses
slightcellulite,Loving my bumps and dents <3
bootyshorts,"The more booty my shorts show, the better"
bootyshorts,Booty shorts can never be too short
bootyshorts,these ones are so tight on my ass
bootyshorts,It’s an early morning cheeky view
bootyshorts,My booty can’t help but eat my shorts
bootyshorts,My favorite shorts to wear around the house.
bootyshorts,Who doesn't like see through Booty shorts
bootyshorts,Cuff the booty just right
bootyshorts,my booty likes to eat these shorts
bootyshorts,When I wear no panties I get my shorts all wet
bootyshorts,i’ll spread my cheeks for you
bootyshorts,Peel them off slowly before you have your way with me
PAWGtastic,Walk with me
PAWGtastic,Bury your cock between my phat cheeks
PAWGtastic,"This bikini is super tiny, maybe too tiny…"
PAWGtastic,I’m just 5’2 but I got over 40 inches of booty for you
PAWGtastic,Look at that booty go!
PAWGtastic,so soft you can use it like a pillow
PAWGtastic,"i'm not wearing any panties under here, let me show you"
PAWGtastic,I like keeping my ass easily accessible
PAWGtastic,If you’re an ass man how glorious is mine looking right now
PAWGtastic,There be treasure under the rainbow!
PAWGtastic,"hold on, let me get these leggings out of the way first..."
PAWGtastic,I’m the kind of girl that needs my ass eaten everyday
tight_shorts,Fuzzy shorts
tight_shorts,I think they’re pretty cute ;)
tight_shorts,love to show you my booty in shorts
tight_shorts,i like my shorts shorter than my patience
tight_shorts,My favorite pair ;)
tight_shorts,Tight and tiny pair
tight_shorts,Drop a comment if I gave you an erection
tight_shorts,Cozy tight sleep shorts
tight_shorts,All nice and tight
tight_shorts,Easily my favourite shorts
tight_shorts,I want you to stain my shorts in doggy style
tight_shorts,I love the tight shorts on my one piece ;)
twerking,"Slow motion, fast heartbeat"
twerking,I love it when you stare on my Ass while I twerk
twerking,I love twerking while you watch
twerking,Lets find out if you can handle this ass
twerking,hoping you have a thing for fat butts in tiny shorts
twerking,jiggly like jello
twerking,Mom of 2 alone for the weekend
twerking,love how my ass swallows up my panties when i'm making it bounce
twerking,I can’t stop twerking while I’m lonely at my parents’ house
twerking,"You jerk, I’ll twerk ;)"
twerking,My ass is built for twerking
twerking,My ass is built for twerking
AmazingCurves,"Oh no, my pants fell down"
AmazingCurves,Lazy Sunday in bed
AmazingCurves,Curvy moms are fun at naptime
AmazingCurves,I'm not Irish but I'm definitely putting Baileys in my coffee today
AmazingCurves,"Which picture of my ass is best, 1, 2, 3, or 4"
AmazingCurves,46(f) mom of 3 .. hi there
AmazingCurves,Hope you can have some fun with them
AmazingCurves,My type of man sucks on titties on the first date
AmazingCurves,Feeling wild and free in my birthday suit.
AmazingCurves,"My tits should never be hidden, so there you go"
AmazingCurves,"Little bit of a throwback to the early 2000's, but naked and busty."
AmazingCurves,Do curvy Pakistani girls turn you on
homemadexxx,Always love to watch it back from his POV
homemadexxx,My titties are almost perfect
homemadexxx,There's no point in wearing this kind of lingerie unless it's to tease you... I hope it worked
homemadexxx,Naturally slutty with pretty titties
homemadexxx,I let him use my ass
homemadexxx,I couldn't believe that he came and then kept fucking me
homemadexxx,He came real quickly after this
homemadexxx,Wondering if guys like eating shaved pussy more
homemadexxx,When she says to only put the tip in but you know how to do it
homemadexxx,Nothing but stockings and perfect titties.
homemadexxx,Enjoying my rare alone time…..
homemadexxx,"He was so close to cumming, holding on with each stroke"
onlynudechicks,"Came to post pussy, i hope it makes you hard"
onlynudechicks,I’m the type of girl your creampie on the first date.
onlynudechicks,I’m super tiny.. I wonder if you’ll fit inside me
onlynudechicks,4’11 with a delicious ass
onlynudechicks,This is my favourite outfit to make older guys hard ;)
onlynudechicks,I wonder if you can handle all this ass
onlynudechicks,Just a simple nude
onlynudechicks,Fuck me like a slut
onlynudechicks,I wish eating pussy on the first date was acceptable
onlynudechicks,If you find me attractive i owe you a pussy pic ;)
onlynudechicks,I wish eating pussy on the first date was acceptable
onlynudechicks,Bikini or naked on the beach
BornToBeFucked,Leave a word if you think my pussy is cute BTBF
BornToBeFucked,who wants to suck on my texan naturals? [btbf]
BornToBeFucked,These perfect titties deserve to be sucked and fucked [BTBF]
BornToBeFucked,who wants my juicy naturals all in their face? [btbf]
BornToBeFucked,I don't think you'd be able to last 10 minutes in bed with me [BTBF]
BornToBeFucked,can i ride you everyday after work? [btbf]
BornToBeFucked,who wants me as their personal fuckdoll? [btbf]
BornToBeFucked,Just turned 18 and still very new to all this... am i still cute BTBF
BornToBeFucked,slim thick just means I was BTBF
BornToBeFucked,Would you fuck an y/o e-girl? BTBF
BornToBeFucked,would u still grab my thick ass even if u knew i'm a virgin? btbf
BornToBeFucked,Do guys really don't like 4'9 girls? BTBF
QOS,Creampied again
QOS,Should I wear this to the beach this summer ?
QOS,If you think I should go bbc only leave a ♠️
QOS,Leave your favorite emoji if I should fuck him
QOS,Pretty hot that one of the internet cucks made this out of my content ♠️
QOS,The pics I send hubby when I’m out of town.
QOS,QOS since June 2014 ♠️
QOS,I travel a lot for work which has become my favorite part of the job
QOS,Imagine getting this video from your girlfriend when you’ve been wondering where she is. And all she’d say is “I found someone bigger… a lot bigger.” What would you say back?
QOS,"This is what real sex looks like. If girls don’t moan like this when you’re fucking them, it might be because you’re too small! A lot of little dicked guys find watching more fun anyway. What about you?"
QOS,"Wife always goes bare back, it’s so exciting watching BBC fill her with cum."
QOS,"I’ve lost count of the creampies at this point, they’ve been using me for hours and they’re def not gonna stop soon. Load after load in my tiny pussy! It’s the hottest thing ever"
JizzedToThis,Nice View
JizzedToThis,Mr Plow
JizzedToThis,Absolutely Covered
JizzedToThis,What a finish
JizzedToThis,He lasted 3 minutes
JizzedToThis,Milf got skills
JizzedToThis,What do you call a girl that licks her own pussy juices? 🥹
JizzedToThis,Big Ass
JizzedToThis,She got him right to the edge and I finished him off in my mouth…
JizzedToThis,Jerked by 4 Angel hands
JizzedToThis,Covered my face in the changing room and then I wore it out to finish our shopping
JizzedToThis,Something about her
HomemadeNsfw,React if I can send you my squirting video in your DMs (instant)
HomemadeNsfw,will you pull out in time?
HomemadeNsfw,will you fuck me everyday if i was your roommate?
HomemadeNsfw,I love knowing I caused that cumshot!
HomemadeNsfw,can you fuck me straight after work?
HomemadeNsfw,Would you put your face or dick between them?
HomemadeNsfw,Would you put your face or dick between them?
HomemadeNsfw,out of 10 how suckable do my naturals look?
HomemadeNsfw,who wants to play with my big naturals?
HomemadeNsfw,am i cute enough to be your fuckbuddy?
HomemadeNsfw,Want someone to help me uncover my deepest fantasies? Let's get started!
HomemadeNsfw,My friend told me that he never had anal before so I changed that for him. It’s nice to be a thoughtful friend :)
Slut,What's more attractive my face or my boobs?
Slut,A British blonde slut needs a cream pie this weekend
Slut,I was a naughty girl
Slut,do we get private dick pics if we sent you this?
Slut,Do I get a private dick pic if I sent you this?
Slut,Are there guys out there who would be into a nerdy little gothling who looks the same at 31 as she did at 18? 😆
Slut,do we get private dick pics if we sent you this?
Slut,Is it acceptable to go to work with no underwear on?
Slut,I almost got caught with my titties out at work... would you tell on me?
Slut,What do you call a girl who loves to hang around with her pussy exposed? 😋
Slut,It was not my plan to cause a boner to all my classmates
Slut,Do I get a private dick pic if I sent you this?
nsfw_gifs,⚠️CAUTION⚠️ Latinas fuck back
nsfw_gifs,Sex tape from start to finish
nsfw_gifs,I made a little swimsuit just to take it off for ya
nsfw_gifs,I was creaming before he even put it in
nsfw_gifs,Pure passion and sexual chemistry
nsfw_gifs,I can’t keep my hands off him…
nsfw_gifs,The prettiest little fuckdoll
nsfw_gifs,Blowjob from start to finish
nsfw_gifs,Petite and fertile 🥰
nsfw_gifs,If my neighbors peeked over the fence they’d definitely get a show
nsfw_gifs,20 minute sex tape in 60 seconds
nsfw_gifs,Proof they’re naturals 😝
bodyperfection,Officially in the last year of my 20’s and I feel hot!
bodyperfection,A raw and basic nude for you.
bodyperfection,The most important thing about self care Fridays is not the gin+tonic but the edged orgasm.
bodyperfection,I'm horny so I can't keep my clothes on
bodyperfection,i like my eggs scrambled in the morning
bodyperfection,Getting naked is always a good idea
bodyperfection,"The older I get, the sexier I feel"
bodyperfection,Wanted to show off my nakedness this morning
bodyperfection,Makes me happy showing of my naked body
bodyperfection,No clothes on kind of day
