Subreddit,Caption
paag,Down to pound my Korean Booty? 🍑
paag,POV: I noticed that you are spying on me
paag,Can I send you selfies like this?
paag,What do you think? :)
paag,are you pulling out of a 4'11 japanese girl?
paag,Wanna give my Korean booty a taste? 🖤
paag,the slimthick little asian girl from south east asia
paag,Just wanna be built like Mewtwo 😤
paag,I want you to fuck me like a slut
paag,Can you handle it
AwesomeAss,She’s Going Crazy
AwesomeAss,Erin Everheart Riding
AwesomeAss,Showing Off Her Ass
AwesomeAss,Squatting Onto His Cock
AwesomeAss,That’s a Tiny Chick but a Juicy Ass
AwesomeAss,Pawg Anal
AwesomeAss,Perfect Tight Brunette Gets Her Ass Filled Up
AwesomeAss,Eva Lovia
AwesomeAss,Definition of The Perfect Ass
AwesomeAss,Goes Faster and Gets Wet
AwesomeAss,They’re Fun to Watch
AwesomeAss,Dakota Skye Is Fucked in The Ass
PerkyButts,my perky butt
PerkyButts,I'm waiting to see what you do with me tonight.
PerkyButts,"Cherries, peaches...mmm I'm missing some cream..."
PerkyButts,eat my butt
PerkyButts,a sucker for when a guy holds me by the waist during doggy 🥺
PerkyButts,How’s my Ass?
PerkyButts,You wanna get in this ass
PerkyButts,Sweet as nectar
PerkyButts,Slap my ass and count the jiggles
PerkyButts,you're gonna love the taste of that ass
PerkyButts,All I want is a dick in my ass
PerkyButts,Are you gonna watch the movie or enjoy my ass?
Nude1819,Would you fuck me if I was your neighbor?
Nude1819,I'm 18 yo horny slut
Nude1819,I am a girl who likes to play
Nude1819,Would you fuck me if I was your roommate?
Nude1819,This is what most of guys in college wants to see
Nude1819,your daily motivation
Nude1819,I'll show you what true pleasure feels like
Nude1819,I sometimes can’t believe people actually like this body type
Nude1819,Guys from school are laughing at my boobs but I'm loving it
Nude1819,Your daily dose of Asian pussy
Nude1819,your dicks daily dose of nude from this teacher
Nude1819,I have really cute tits and I show them to you
asssophat,Do you like my chubby ass?
asssophat,Who’s willing to give me my first anal creampie?
asssophat,"My ass loves to eat thongs, but loves dicks more"
asssophat,Cute💙 Ebony🍫25$ video calls on my telegram: KSGoddessMarie or snap: KSGoddessMarie
asssophat,Trust me it would look better on your face
asssophat,Will you eat my ass on the first date ?
asssophat,You like my curves?
asssophat,you’ll need both hands to handle this ass
asssophat,Latina cum dumpster
asssophat,Eat my Asian ass
asssophat,"Don't be shy, stick out your tongue and start licking"
asssophat,Can I sit on you?
NSFW_Snapchat,Sticky fingers
NSFW_Snapchat,Snowwhite and whitecock
NSFW_Snapchat,Don’t wait up baby! I’ll keep you updated 🦊
NSFW_Snapchat,Oh didnt see you there...
NSFW_Snapchat,Aw baby he’s so cute… he doesn’t know I do this with all your friends 🦊
NSFW_Snapchat,I know you want me👻⬇️
NSFW_Snapchat,Dont just stare… cum get it👻⬇️
NSFW_Snapchat,Some naked yoga
NSFW_Snapchat,I think your girl likes working from home 🦊
NSFW_Snapchat,Surely my wedding ring won't stop you
NSFW_Snapchat,Let’s flip a coin…whichever side it lands on is what I’m giving you..
NSFW_Snapchat,Can i be your snapchat slut ? 💕
rice_cakes,Delicious Korean fish in a net
rice_cakes,Would you eat my booty for lunch? 😋
rice_cakes,Fuck me sticker on my ass to make your horny
rice_cakes,Feel like some Korean rice cakes? 🖤
rice_cakes,My asian ass
rice_cakes,Don't just stand there... come and get a taste! 👅
rice_cakes,I love getting fucked from behind!
rice_cakes,I let you eat my ass
rice_cakes,I love taking selfies!
rice_cakes,glute-inous rice cakes
rice_cakes,"My ass need to be eaten 2 time per day, please"
rice_cakes,Is my booty to phat for you?😳
StarAss,should i let my boyfriend have a taste of my ass or not?
StarAss,Enjoy your meal
StarAss,Do older men genuinely enjoy the taste of ass?
StarAss,"Would you eat my ass on a first date, or are you too shy?"
StarAss,I want someone to be with right now
StarAss,good appetite and good mood
StarAss,You’re fucking a star
StarAss,Anal swinging fun
StarAss,my ass and your dick should be friends
StarAss,So freakin’ pretty
StarAss,It’s perfect
StarAss,If I was your wife how often would you fuck my ass?😍
DamnASS,Omg...look at Her Ass!
DamnASS,Teen Pawg No Panties Twerking
DamnASS,Riley Sucking Balls on a Cock Deep in Lana's Ass
DamnASS,Shaking Her Phat Ass
DamnASS,Loved It
DamnASS,Mia Malkova’s Bubble Butt Jiggling in Standing Doggy
DamnASS,…
DamnASS,Code Pls
DamnASS,Dildo in The Ass Makes Her Pussy Grool
DamnASS,Amazing View
DamnASS,I'ma Put It in Her Ass
DamnASS,Ashley Alban Shaking Her Amazing Ass
BoltedOnBooty,Best BBL?
BoltedOnBooty,Mommy🥵
BoltedOnBooty,"Find me a better 21 year old on the planet, I’ll wait."
BoltedOnBooty,Perfect bimbo
BoltedOnBooty,Only 21 and she’s already got a chokehold on the game.
BoltedOnBooty,😈
BoltedOnBooty,HOLY FUCK THAT ASS IS HUGE 🤤
BoltedOnBooty,Wifey
BoltedOnBooty,🔥🍑
BoltedOnBooty,Could you last a 2 minute lap dance without bussing a Nut 🤔Honest Answers Only.
BoltedOnBooty,Baddie. How can I find a woman with a bolt on booty to be my girlfriend?
BoltedOnBooty,🇰🇷
BeautifulBigButts,"I was a bit doubtful but I decided to post, be so kind..."
BeautifulBigButts,Which Curvy Big Butt Slut Would You Stick Your Hard Cock Into? A? Or B? 😈🔥🍑🍆🍆🥵
BeautifulBigButts,"Which Big Butt Slut Would You Pound Doggy Style With Your Hard Cock? A, B, or C? 🍑🍑🍑🍆🥵🔥"
BeautifulBigButts,Fat and jiggly
BeautifulBigButts,Is this your type of ass?
BeautifulBigButts,Big booty brunette
BeautifulBigButts,"It’s definitely big, is it beautiful?"
BeautifulBigButts,Which Bimbo Ass Would You Pound All Day Long? 1 or 2? 🍑🍑😈🔥
BeautifulBigButts,Into wedgie?
BeautifulBigButts,G a m i n g
BeautifulBigButts,Big booty brunette
BeautifulBigButts,Wait until I turn around...
AsianTeensGW,Everything got a little dirty
AsianTeensGW,Smash or pass? 50 commenters will get my nude
AsianTeensGW,Perfectly shaved for you
AsianTeensGW,I need a friend who wants to fuck my little asian pussy on a stool
AsianTeensGW,I’ve been single for too long
AsianTeensGW,My application to be your petite brown 18yo secretary
AsianTeensGW,I should practice this on your face
AsianTeensGW,My application to be your secretary
AsianTeensGW,More naughty then I ever was
AsianTeensGW,I wanna be daddy's little girl
AsianTeensGW,Are you ready for what I'm about to give you?
AsianTeensGW,Give a ❤️ if you would fuck me 😉 first 50 commenters will get the nudes
Snapchat_Thots,Cheating with boyfriend's dad 🥰
Snapchat_Thots,Cheating on him with his bestfriend is the best feeling....
Snapchat_Thots,Helping her boyfriend's bully
Snapchat_Thots,"You can fuck me everyday dadddyyyy, My OnlyFans is free link down below 😈😈"
Snapchat_Thots,"I want to worship your 🍆daddy, My onlyfans is free link down below"
Snapchat_Thots,call me mommy and you get the uncensored version
Snapchat_Thots,"My OnlyFans is free, link down below daddy"
Snapchat_Thots,My huge tits need a gentle caress before bed
Snapchat_Thots,Snapchat: Paulicoa 👻
Snapchat_Thots,I manipulated him to cheat on his ugly wife😈 - my OnlyFans is free link down below
Snapchat_Thots,"drop a ""YES MOMMY"" for a free preview"
Snapchat_Thots,would you fuck this body?
WhyEvenWearAnything,"Yes, I actually wore this out to a club in Atlantic City."
WhyEvenWearAnything,Florence Pugh
WhyEvenWearAnything,POV: You get caught staring at us in our sheer shirts
WhyEvenWearAnything,An afternoon stroll through Venice in our see-through shirts
WhyEvenWearAnything,Festival girl
WhyEvenWearAnything,Found a 1960s sheer dress and I'm never taking it off
WhyEvenWearAnything,i like attention from guys on the street
WhyEvenWearAnything,Lots of coverage - very sophisticated
WhyEvenWearAnything,Heading back to my hotel after EDCLV :-D
WhyEvenWearAnything,Yellow is my favourite colour.
WhyEvenWearAnything,Like the dress I wore out yesterday night?
WhyEvenWearAnything,Just holding back
Lightskin,Where will you cum
Lightskin,Which you like better?
Lightskin,I love the view of my pussy from below ;)
Lightskin,What caught your attention first? Bush or boobs?
Lightskin,Daddy do you like a fat cat that squirts?😈💦
Lightskin,Will you have taste of it?
Lightskin,just slide in
Lightskin,I just want you to taste it and then kiss me
Lightskin,"If I let you fuck me on the first date, are you pulling out?"
Lightskin,will you use me
Lightskin,i should totally fuck a redditor
Lightskin,It's been a little
slightlychubby,Would you let a chubby girl ride your face?
slightlychubby,I think I hide my chubby well
slightlychubby,"So, what are we doing at the park? 😈"
slightlychubby,🧸
slightlychubby,"I'm not shy, cum on my tummy"
slightlychubby,I’m chubby but is it ok if I sit on your face ?
slightlychubby,What will you call me
slightlychubby,Got chubbier and I feel sexier
slightlychubby,I have the perfect body for fucking ;)
slightlychubby,I just want someone to rip my bikini off and fuck me like the chubby princess I am
slightlychubby,"My pussy is chubbier now, would you still fuck it?"
slightlychubby,Would you let me ride your face
BestGirlsGoneWild,Incredible
BestGirlsGoneWild,She's so sexy
BestGirlsGoneWild,Devoured From Both Sides Til He Explodes
BestGirlsGoneWild,Amazing!
BestGirlsGoneWild,Love her ass
BestGirlsGoneWild,Masseuse enjoying her client
BestGirlsGoneWild,Facial for her and then he goes down her throat again
BestGirlsGoneWild,Teacher teaches students taught how to suck breasts
BestGirlsGoneWild,Titties sucked
BestGirlsGoneWild,Amazing Double Penetration Sex In Porn Debut
BestGirlsGoneWild,Amazing Boobs
BestGirlsGoneWild,Sensual sex
BestGirlsGoneWild,Abella Danger Has An Intense Orgasm
BestGirlsGoneWild,Standing Doggy
BestGirlsGoneWild,Wagered Affairs
BestGirlsGoneWild,Facesitting And Squirting
BestGirlsGoneWild,Hazel Moore Does Anal Gangbang With Big Black Cocks
BestGirlsGoneWild,So hot
BestGirlsGoneWild,Standing Doggystyle Sex
BestGirlsGoneWild,Heaven
BestGirlsGoneWild,Redhead Creampie
BestGirlsGoneWild,Perfect Tits In Doggy Style
BestGirlsGoneWild,Amazing!
BestGirlsGoneWild,Creamier and creamier
BestGirlsGoneWild,Pronebone
BestGirlsGoneWild,She Wanted the Backstage BBC Treatment
BestGirlsGoneWild,Stacy Cruz Passionate
BestGirlsGoneWild,Willow Ryder & Dredd
BestGirlsGoneWild,Hot Girls
BestGirlsGoneWild,A massage with a happy ending
BestGirlsGoneWild,Gianna Dior Having Passionate Sex
BestGirlsGoneWild,That Face
BestGirlsGoneWild,Secret Recipe
BestGirlsGoneWild,Blondie Fesser has sex on the beach
BestGirlsGoneWild,My new roommate just found out how friendly I get when I am drunk
BestGirlsGoneWild,Kendra Lust Fucks Couples
