Subreddit,Caption
bodyperfection,One adjective to describe the state i will be in after you rail me
bodyperfection,Everything in its place
RateMyAss_,Please rate my thick 19yo ass
RateMyAss_,Do guys think my booty is latina worthy even though I'm only 18
RateMyAss_,my ass is always hungry idk why
RateMyAss_,"my bff's brother said i have the best butt in our class, u agree?"
RateMyAss_,rate it honestly please
RateMyAss_,is my ass good enough for back shots
RateMyAss_,On a scale of 1 to 10 how badly would you beat it up? (18F)
RateMyAss_,give me your honest rating please
RateMyAss_,rate this one for me
RateMyAss_,What do you think?
RateMyAss_,perfect fuckable ass
RateMyAss_,Is it nice for 18?
OnOff,My ID shows 30 years old.. my mind is saying 21 y/o naughty college girl
OnOff,DD milkers on my tiny frame😏💚
OnOff,Four kids later…
OnOff,Just a regular mom in the morning
OnOff,I went clubbing in London the other week. This was the outfit of the night.
OnOff,Typical mom body of one.. 36f
OnOff,My Milfie Milkers reveal 😜
OnOff,I've always wondered what a man's first thought is when he sees me naked...
OnOff,Almost got caught taking this😋😏
OnOff,On/off classy Grace version. I need a man in a suit to join me!
OnOff,Outfit of the day; Sometimes I dress like a tomboy.
OnOff,"Underneath the scenes….46, 4 kids"
BonerMaterial,How’s your pullout game
BonerMaterial,Tongue or fingers first
BonerMaterial,46(f) would you? (BTBF)
BonerMaterial,Giving the hot neighbour a boner
BonerMaterial,Tell me ifmy soft body makes you hard
BonerMaterial,I'm not on birth control
BonerMaterial,They’re very fun to play with
BonerMaterial,This would feel really good with you inside me
BonerMaterial,Want to know if you think I'm boner material. First post
BonerMaterial,I just shaved my pussy and now she needs a boner
BonerMaterial,I've been told I'm hotter than the flames on Mustafar.
BonerMaterial,Almost as good as the real thing
Thicker,How’s the view…
Thicker,Being thick makes me happy
Thicker,I’m just 5’2 but I got over 40 inches of booty for you
Thicker,Thicker means jigglier too
Thicker,I feel like I hide my thick pretty good under this dress
Thicker,"My booty is like an avocado, the good kind of fat"
Thicker,I like my hips grabbed in doggy
Thicker,Are you down for shower sex with a chubby girl like me :)
Thicker,I think these strips are becoming my new favourite videos to post
Thicker,Thick girls have the best pussies
Thicker,Searching for somewhere more comfortable to sit my ass... such as your face
Thicker,Panties on a side are so underrated
slutsofsnapchat,Can I send you nudes on Snapchat?
slutsofsnapchat,Sending nudes to random dude lmk if u want one
slutsofsnapchat,fuckable or nah ? (22f)
slutsofsnapchat,sending random nudes to men here anyone in?
slutsofsnapchat,Has your girlfriend sent you nudes or do I have to?
slutsofsnapchat,Please someone fuck my ass!
slutsofsnapchat,Would I get a private dick pic if I sent you this? ;)
slutsofsnapchat,whos down fucking me in the shower real quick?
slutsofsnapchat,Would I get a private dick pic if I sent you this? ;)
slutsofsnapchat,"i love sending nudes to random men, u in?"
slutsofsnapchat,my new passion is sending random nudes especially if you are with your gf
slutsofsnapchat,"Sending naughty vids to random strangers, who's in?"
TitsandAssLovers,Let Jillian and I know where you live assuming you want to have some fun!!
TitsandAssLovers,F 40. Little side peek of my T&A. First post here
TitsandAssLovers,I've got a surprise for you today
TitsandAssLovers,are you personally a fan of pale cheeks
TitsandAssLovers,you have permission to rip these off
TitsandAssLovers,My pastor says it's too short for church. Wdy think? 😏
TitsandAssLovers,i like a man who is always horny
TitsandAssLovers,My hairy Chinese pussy needs love too! 🥺
TitsandAssLovers,you better rub it until you fall asleep
TitsandAssLovers,Body Debate: average natural tittes and ass or big fake titties and brazillian butt lift? 🤭
TitsandAssLovers,i like a man who eats pussy any time of day
TitsandAssLovers,I hope you are willing to help me with your tongue
girlsinleggings,i just think it’s more fun when they’re wet🤤
girlsinleggings,felt cute on my hike :)
girlsinleggings,were you watching me stretch?😝
girlsinleggings,I just hope that no one out there saw my wet spot
girlsinleggings,always knew I loved purple
girlsinleggings,"squeeze it, smack it, slap it"
girlsinleggings,I love doing cardio in the morning
girlsinleggings,I love my butt being touched when I'm in my leggings
girlsinleggings,Should I wear them in the gym today?
girlsinleggings,you look like you're hungry
girlsinleggings,I feel like this mirror makes me look so short for once (I'm 5'11)
girlsinleggings,I wouldn’t mind if you stared at me
bangmybully,Delete them!!! A bully origin story part 1
bangmybully,Your slutty sister keeps asking your bully to do more and more degrading things to her. Why can't you stop her?
bangmybully,Delete Them!!! Part 2
bangmybully,Your sister and your bully end up teaming up
bangmybully,Humiliating herself and her son
bangmybully,Who are you watching your bully fuck?
bangmybully,Ultimate defeat
bangmybully,One by One
bangmybully,What good are you?
bangmybully,"You’re pathetic. You walked in on your bully fucking your girlfriends brains out, but you just stood there and watched"
bangmybully,Friendly reminder… your bully had your girlfriend begging and screaming out his name while he fucked the shit out of her…
bangmybully,Madison Is the Best Tutor - Part 3 (Final) - Oral Exam 🐢
StreetsIsWatchin,You cant pull out
StreetsIsWatchin,Let me milk you dry
StreetsIsWatchin,Let me milk you dry
StreetsIsWatchin,Easy access outfit cause I'm too old to waste time undressing
StreetsIsWatchin,Just turned 18 and still 4'9 small... at least boobs are kinda big?
StreetsIsWatchin,First time posting myself nude on here and just turned 18... am i looking good to you?
StreetsIsWatchin,Let me drain your balls
StreetsIsWatchin,One hole is filled... Wanna fill the other?
StreetsIsWatchin,Are my 18yo boobs too huge for you?
StreetsIsWatchin,Guess I should be learning rn...<3
StreetsIsWatchin,Time for a titty tan
StreetsIsWatchin,Slurping that dick up
slutwife,Determined to breed
slutwife,I hear that redhead wives are the hardest to pull out of
slutwife,My husband says that anyone can have a turn today
slutwife,Slut wives like me will hop on any cock
slutwife,"Hubby said he wants to watch another man make me scream, you in"
slutwife,Is my body gangband material?
slutwife,Doc said I have a vitamin D deficiency. Have any to spare?
slutwife,Can I “accidentally” send you some nudes?
slutwife,"There is nothing wrong with my marriage, I'm just allowed to fuck any guy I want"
slutwife,Even nice Canadian wives have a naughty side
slutwife,My husband loves watching me be a slut for other men
slutwife,My husband finally agreed to let me fuck other men
facedownassup,My holes are waiting to be filled
facedownassup,My holes are waiting for you to slide in
facedownassup,Eager to get both my holes filled
facedownassup,I know many of you have never been with a black girl. Let’s change that!
facedownassup,I always cum so hard being face down ass up.
facedownassup,The thigh highs will stay on while you fill me from behind
facedownassup,First pussy... then ass until u fill it
facedownassup,I need a yoga partner )
facedownassup,I stretch my pussy so you can slide your whole cock inside
facedownassup,Its best to play like this
facedownassup,Eat it before you stick it
facedownassup,I like it when you pull them to the side
collegesluts,Do I get a private dick pic if I send you this?
collegesluts,Do older men prefer 18yr olds fully shaved or unshaved
collegesluts,"If I were you, I’d have sex with me.. multiple times 😜"
collegesluts,My hubby fucked a college girl and filmed it for me to masturbate to. I’m a “cuckquean”
collegesluts,still accepting my nudes even if i’m flat?
collegesluts,18F stacked goth.. first emojj is your impression ;)
collegesluts,"19yo and sending nudes to random men, who’s in?"
collegesluts,do you prefer a gym girl or a horny girl?
collegesluts,fully shaved :3
collegesluts,all my dad's friends wanna fuck me
collegesluts,My dorm room. I'm lying on the bed. You can see my pussy
collegesluts,are my boobs worth skipping school for
palegirls,Here to give you your Sunday hug :3
palegirls,If you like pale girls I'm sure you'll enjoy Irish girls like me
palegirls,No panties ;)
palegirls,Socks :3
palegirls,Pale goth ass is just served
palegirls,So pale and in need of a big dose of D
palegirls,Ready for our walk 😇
palegirls,Pale and thick :3
palegirls,I’m always ready to ride
palegirls,Panties off to reveal my full pale body ;)
palegirls,Just wanted to show you my body
palegirls,Bell on my choker so you don't lose me. ;)
SexyFrex,One kiss per freckle..
SexyFrex,My freckles are really popping after my trip to the beach.
SexyFrex,No clothes go on until each freckle has been kissed❤️
SexyFrex,Frex 🙂
SexyFrex,I'd ask if you could count them all but..
SexyFrex,Freckles and comfy pajamas are the best combination.
SexyFrex,I smile only at cute guys..
SexyFrex,One kiss per freckle
SexyFrex,Just having a real great day
SexyFrex,It’s the perfect time for a freckle kiss count❤️
SexyFrex,Hope you don't mind a freckly bush
SexyFrex,I'm happy because I've just had an orgasm
DadWouldBeProud,left or right??
DadWouldBeProud,"Left, right or both? ;)"
DadWouldBeProud,Sorry dad...
DadWouldBeProud,Would you creampie your best friend’s daughter?😇
DadWouldBeProud,I'm here to feed you and fuck daddy
DadWouldBeProud,Those tits are mesmerising daddy
DadWouldBeProud,"On a scale from ""just the tip"" to ""balls deep"", how much do you wanna fuck me?"
DadWouldBeProud,"On a scale from ""just the tip"" to ""balls deep"", how much do you wanna fuck me?"
DadWouldBeProud,He always said he couldn't take me anywhere
DadWouldBeProud,Petite fuck doll at your service x
DadWouldBeProud,Would you like me to be completely naked when we're alone?
DadWouldBeProud,I hope my dads friend sees this and jerks off
tights,Do older guys still enjoy pantyhose?
tights,Tights definitely makes the legs even more sexy
tights,Do you think it fits through pantyhose?
tights,I know you like sheer
tights,Get on your knees
tights,Bare Wolford are so sexy
tights,I know I dont have a perfect body but it is real
tights,Maybe I should wear tights more
tights,Blue nylon is ur type?
tights,"These tights are so gorgeous, I love them"
tights,Just hot
tights,Do you think wearing no panty is a well idea in winter time ? [OC]
tiktokthots,Incredible Cake
tiktokthots,Gyattt
tiktokthots,Wait for her to turn around
tiktokthots,Comfy and sexy
tiktokthots,Stacked
tiktokthots,Thick Snicker
tiktokthots,Caked up in that dress
tiktokthots,Just beautiful
tiktokthots,Filling up those yoga pants
tiktokthots,Wait for it
tiktokthots,Hot and Curvy
tiktokthots,Surprise included
gymgirls,Would you wait until after I shower or before to make a move?
gymgirls,Am I too skinny for guys to want me?
gymgirls,What do I need to work on most?
gymgirls,Do you like my gym fit?
gymgirls,"what would you do, if you see me in the gym like this?"
gymgirls,Tell me yes and I'll send you my private pics
gymgirls,Just turned 18 and still cannot find a BF… do you think it is because i’m only 4’9 small?
gymgirls,can you see i've been working hard..?
gymgirls,Would you approach me at the gym? 21F
gymgirls,My dad would kill me if he found out i post on reddit... but i'm so happy about all the compliments i get?
gymgirls,How’s my 18 year old ass here?
gymgirls,Do you like my new gym fit?
StrongCurves,10 month progress (May 2023 - March 2024)
StrongCurves,help w upper glutes/glutes from behind
StrongCurves,4 month progress (November 2023->February 2024)
StrongCurves,PSA: Ditch the scale 📣📣
StrongCurves,"From 2020 to 2024, it took me a long time and I’m still trying to get bigger legs :3"
StrongCurves,6 month progress 9/23-3/24 + asking for advice!
StrongCurves,Could you share what do you eat in a day to reach a high protein intake?
StrongCurves,How am I supposed to consume enough protein?
StrongCurves,Are my glutes growing?? April 2023 - February 2024
StrongCurves,Form check for RDL
StrongCurves,How long can you do the program? Advice needed!!
StrongCurves,Form Check pls 🫶
Nudes,Keep her shaved or grow a bush? 🤔
Nudes,"Always horny, always naked"
Nudes,"The closer I get to thirty, the sexier I feel"
Nudes,"You walk past and catch me masturbating on the deck, how do you act?"
Nudes,Do you prefer bush or shaved pussy
Nudes,"Blonde, British, made for fucking"
Nudes,Just a nude before I head to class. College cheerleader here
Nudes,Looking for a snuggle-fuck.
Nudes,is bush or bare better?
Nudes,Should I keep it shaved?
Nudes,Married? Yes. Off limits? Not even close.
Nudes,does my body type turn you on?
hugeasses,I’m obviously bottom heavy… ;)
hugeasses,Look how huge it gets as I bend over
hugeasses,The size definitely surprised you
hugeasses,I'm approximately.. 90% ass
hugeasses,My ex never wanted nudes form me bc im fat do you want some
hugeasses,This is what you find at the end of the rainbow… ;)
hugeasses,made for creampies
hugeasses,Is my ass big enough for you to play with it (F21)
hugeasses,how hard will you spank me
hugeasses,hope my 40yo ass is huge enough for you
hugeasses,"Believe me, this huge white ass can reach great speeds while riding dick. Heh"
hugeasses,"On a scale from 1 to 10, what do you give it"
GirlsGW,Would you have a little taste if I asked nicely? (18F)
GirlsGW,Would you get hard if I'd tease you like this when we are with my parents?
GirlsGW,Would you ask me on a date or straight to give you head?
GirlsGW,"Suns out, DD shamrocks out😏🍀"
GirlsGW,"My sister just fell asleep next to us, can you fuck me in silence to not wake her up??"
GirlsGW,"every reaction gets a nude, try me"
GirlsGW,I caught my classmate staring at my chest from across the room. You think he's into me?
GirlsGW,how likely is it that i'll let u give me a creampie?
GirlsGW,Could you resist your daughter's best friend if she sent you something like this
GirlsGW,fuckable set
GirlsGW,perfect for a raw fuck
GirlsGW,would you play with em?
CreampieMaterial,Are you an older guy looking at my pics… Just say Y or N
CreampieMaterial,Creampie me from behind
CreampieMaterial,Me waiting for you to come empty your balls into me
CreampieMaterial,I need the vitamin D outside
CreampieMaterial,I’m allergic to condoms
CreampieMaterial,Put on lingerie to match my pussy
CreampieMaterial,Yes I'd let you finish inside <3
CreampieMaterial,I’m allergic to condoms
CreampieMaterial,can u cream in me while i ride u like this
CreampieMaterial,I’m allergic to condoms
CreampieMaterial,Are you an older guy looking at my pics… Just say Y or
CreampieMaterial,I bet you can feel the difference in tightness with theselittle holes
CamGirls,are my tits big enough for you?
CamGirls,do i need to make my tits bigger or are they a good size?
CamGirls,be as rough as you want with me...
CamGirls,the best reveal you'll see all week ;)
CamGirls,You get the best view if I'm the one on top
CamGirls,Let me do this for u live on cam
CamGirls,will you take me raw on the first date?
CamGirls,who wants me as their personal fucktoy?
CamGirls,not perfect but all natural
CamGirls,do you prefer tits or ass?
CamGirls,1-10 how suckable do my naturals look?
CamGirls,am i thick enough for you?
BabesNSFW,just turned 18 and my boobs won't stop growing... am i still cute
BabesNSFW,Here’s my fuckbuddy application
BabesNSFW,"Trying to tease you, hope it works"
BabesNSFW,cream in me while i ride ur cock
BabesNSFW,are you into cute texan girls?
BabesNSFW,Just turned 18 and my boobs won’t stop growing… are they too big for you?
BabesNSFW,Just turned legal and cannot find a BF… do you think it is because i’m just 4’9 small?
BabesNSFW,wanna cheat with me?
BabesNSFW,Will u give me a good pounding after work?
BabesNSFW,Are my boobs too big for just turning 18… or they look fine to you?
BabesNSFW,I hope you can handle me
BabesNSFW,How do you like it?
AdorableNudes,can i sit on your face
AdorableNudes,Tell me yes and ill send you my nudes
AdorableNudes,let me ride you all weekend
AdorableNudes,Thick enough to eat
AdorableNudes,I'm naked you should be too 😏
AdorableNudes,my door is always open for my brother's friends
AdorableNudes,If you wake up to my pussy above you like this what do you do next
AdorableNudes,"Like a statue, but fuckable ;)"
AdorableNudes,Tell me yes and i’ll send you some nudes
AdorableNudes,give me all the love you have
AdorableNudes,I’m all wet… how are you going to dry me off
AdorableNudes,I love taking nude selfies on the plane
Babygirl,What does an 18F babygirl do to get attention from older guys?
Babygirl,Your adorable blonde babygirl
Babygirl,Do you accept 2 babygirl applications if we come together daddy?
Babygirl,Would you approach a shy babygirl?
Babygirl,Would you like me to be your babygirl even tho i'm just 4'9 small? [F18]
Babygirl,just turned 18 and still 4'9 little.. am i cute
Babygirl,daddy i just turned 19 and i'm just 4'11.. am i cute anyway?
Babygirl,do you like my titties daddy?
Babygirl,can i ride you all day daddy?
Babygirl,18 and looking for love.... What would we do on our first little date?
Babygirl,Can you work me out with your cock before I go to the gym daddy
Babygirl,do you like my titties daddy?
barelylegalteens,If u get a boner it means u love small boobs
barelylegalteens,"18yr old teen mexicana who's always horny, who's in?"
barelylegalteens,18 and still flat.. still worth breeding?
barelylegalteens,I think 19 it’s the perfect age to have my first creampie
barelylegalteens,"18 and still flat, guess there’s nothing I can do about it"
barelylegalteens,"I wanna send nudes to random men, leave a ❤️ if you're game"
barelylegalteens,could u tell who’s still waiting for her boobs to grow out?
barelylegalteens,Extra airbags ready for the roadtrip
barelylegalteens,The breast passengers around
barelylegalteens,Can you tell my 4'11 fully shaved body just turned 18yrs old
barelylegalteens,leave a “🩷” if I can send you these nudies
barelylegalteens,were are you shooting? Left or right?
NudeNonNude,Chubby mom in a little dress
NudeNonNude,Would you fuck a Marine?
NudeNonNude,Can you describe my body with one word?
NudeNonNude,Ops something is missing
NudeNonNude,Would you want me to take care of your morning wood? F21
NudeNonNude,"Today I send my nudes for random man, who's in (FOR REAL)"
NudeNonNude,Can I send you some nudes ? Just say YES 🤭
NudeNonNude,Would you like me to walk around the house fully nude?
NudeNonNude,Small girls with little tits your type
NudeNonNude,May I send you more nudes? Yes or no?
NudeNonNude,As soft as snow
NudeNonNude,Would you fuck a Marine?
LegalCollegeGirls,What are the chances we fuck on our first date?
LegalCollegeGirls,can we be your new room mates?
LegalCollegeGirls,"This is my body at 19, what do you think?"
LegalCollegeGirls,Just turned 18 and still unexperienced with dating boys... will that stop me from dating older guys?
LegalCollegeGirls,Would you fuck a barely legal teen knowing her parents are in the next room?
LegalCollegeGirls,daddy can i bounce on your cock like this??
LegalCollegeGirls,"My parents are gone for the morning, let's fuck all over their house"
LegalCollegeGirls,Just turned 18 and my boobs finally started growing! Would you play with them even tho i’m just 4’9 little?
LegalCollegeGirls,The girls say thay my 4’9 body isn’t proportional to my boob size… do i still look cute? [F18]
LegalCollegeGirls,big enough?
LegalCollegeGirls,College girls are always down for some fun
LegalCollegeGirls,Are my boobs too big for just turning 18… or they look fine to you?
NSFWGirl,fom the warzone to the promised land.. ukrainian sweetheart
NSFWGirl,Are you a boob or an ass guy?
NSFWGirl,my nipples are hard and ready for sucking 😝
NSFWGirl,Can I be your backup when your gf is mad?
NSFWGirl,can you finish on my boobs?
NSFWGirl,Do you think guys will notice me if I wear this to school? F18
NSFWGirl,I was that girl in high school call dump truck ass
NSFWGirl,will you fuck me everyday if i was your roommate?
NSFWGirl,"Guys at school see me as one of the boys, do older guys think I'm sexy?"
NSFWGirl,can you fuck me missionary everyday?
NSFWGirl,do i look like a girl who's searching for a fwb? hbu?
NSFWGirl,creampie or pull out?
RealCute,The giggliest
RealCute,So cute and so busty
RealCute,who wants my cute boobs in their face?
RealCute,"My crush said I was too cute fuck, what do you think?"
RealCute,can i have your big load all over me?
RealCute,Just turned legal and cannot find a BF… do you think it is because i’m just 4’9 small?
RealCute,ever fuck a cute texan girl like me?
RealCute,creampie or pull out?
RealCute,am i cute for just having turned 18
RealCute,cute enough to have your big load all over me?
RealCute,do you think I am cute enough to date or only ONS!?
RealCute,A little something to make your day better ;)
Backview,Smack it please daddy
Backview,Bend me over and stick it in me babe
Backview,I’ve been told I have a sexy back before… can you confirm?
Backview,I'd let you fuck me on the floor
Backview,"Be honest, would you fuck me in the ass if I was your friend's girlfriend?"
Backview,Not a bad view from the back
Backview,Help me stretch my asshole?
Backview,"if we watch anime, can i put my butthole on ur mouth after?"
Backview,I enjoy the men who eat ass
Backview,I enjoy the men who eat ass
Backview,Come over and eat this juicy ass
Backview,Not a bad view from the back
realHomemade,drop a yes and i’ll send u my sex tape instantly
realHomemade,"just turned 19, fuck or pass?"
realHomemade,Come take a ride with me
realHomemade,Pov you walk into my bedroom to see me doing this on my bed
realHomemade,"drop a ""yes"" if u masturbated today"
realHomemade,will my boyfriend let me suck off a friend when he's not around or not?
realHomemade,Tell me yes and i’ll send you my sex tape (instant)
realHomemade,would u fuck me with no condoms on
realHomemade,"Here’s my eighteen year old scrawny looking body, not the prettiest on here"
realHomemade,would you still grab me by the hips if i tell u i'm on my period?
realHomemade,tell me yes and i’ll send u more of my nudies (instantly)
realHomemade,"Simply say ""hi"" if ur older than 20 and i'll send u something, try me"
stripgirls,My 5th decade hoping it’s still sexy when I undress…
stripgirls,If you don’t mind a 5th decade mombod strip…
stripgirls,Still stripping in my 40’s..
stripgirls,Just a mum in my 40’s that wanted to strip…
stripgirls,Not perfect but all natural ❤️
stripgirls,When the mom next door strips it off for you…
stripgirls,Just a girl that loves to show off
stripgirls,This bikini barely covers anything anyways
stripgirls,Just a regular neighborhood mum learning to be a stripgirl
stripgirls,Just a mombod strip after gardening
stripgirls,"Still new and not sure how this works, how am i doing?"
stripgirls,Twinkle twinkle little star let’s have sex inside my car:)
naughtychicks,Just made a mess
naughtychicks,Your friendly neighborhood braless girl
naughtychicks,I got hot in the car so I cooled myself down
naughtychicks,This pussy always wanna ride some face
naughtychicks,Heading outside so my neighbours can see
naughtychicks,Clothes are unnecessary when it's this nice out
naughtychicks,I'm horny so I can't keep my clothes on
naughtychicks,"Are you just gonna sit and watch, or are you getting inbetween my thighs."
naughtychicks,Can you tell how horny i am
naughtychicks,Going to the gym with no bra on gets everyone pumped :)
naughtychicks,Should I wear these leggings to the gym
naughtychicks,Did someone ask a hottie to fuck hard..
MirrorSelfie,If I am a 10/10 with these clothes on then what would I be if I took it all off?
MirrorSelfie,Can I ride you?
MirrorSelfie,You asked me to ditch the bra so i did... how are they looking?
MirrorSelfie,what would u do if we're home alone? 19
MirrorSelfie,19 and still a little shy... will you appreciate my body
MirrorSelfie,You asked me to ditch the bra so i did... are they too huge? (F18)
MirrorSelfie,Would you use my backdoor <3 :p
MirrorSelfie,You asked me to ditch the bra so here's me without one... how am i looking? [F18]
MirrorSelfie,I'm finished with my chores daddy... what should we do next? [F18]
MirrorSelfie,"might watch a movie in bed, would you join?"
MirrorSelfie,You know what I want
MirrorSelfie,In search of another cuddle buddy ;) wanna join?
Hotchickswithtattoos,"Native American, with my sun god tattoo"
Hotchickswithtattoos,It is a Thursday. almost Friday. (and almost st. paddy's day!)
Hotchickswithtattoos,"Formal fuckbuddy application, u must love oral to apply"
Hotchickswithtattoos,Tatty's and titties are the meaning of life.
Hotchickswithtattoos,"Emo girls still exist in 2024, and we're hotter than ever."
Hotchickswithtattoos,"The classic emo MySpace girl pose, but make it naked."
Hotchickswithtattoos,first day without cloud cover called for exposed titties :)
Hotchickswithtattoos,My sternum was by far the most painful of my tattoos
Hotchickswithtattoos,"Curvy, fit, and tatted"
Hotchickswithtattoos,Thinking of getting an under boob tattoo
Hotchickswithtattoos,Tattooed little slut on the rooftop pool deck
Hotchickswithtattoos,What I don’t have in boobs I make up for in ass
SexyButNotPorn,Sexy or just cute?
SexyButNotPorn,Would you have a problem with me wearing this to my lifeguard shift?
SexyButNotPorn,are my boobs big enough for you?
SexyButNotPorn,is this a good set?
SexyButNotPorn,are my boobs big enough for you?
SexyButNotPorn,"thought of getting a tattoo, but i'm unsure if it's too rebellious for someone my age"
SexyButNotPorn,make my legs shake
