Subreddit,Caption
SexyButNotPorn,make my legs shake
SexyButNotPorn,make my legs shake
SexyButNotPorn,Sexy enough for you?
SexyButNotPorn,i am hot enough for you daddy???
SexyButNotPorn,How's everyone's Monday doing?
ThickchicksGW,"Bang me, baby"
ThickchicksGW,Jerk off to me?
ThickchicksGW,am I too thick?
ThickchicksGW,am I fuckable?
ThickchicksGW,Thick and nerdy
ThickchicksGW,Need some sex.
ThickchicksGW,Ready for you
ThickchicksGW,am I fuckable?
ThickchicksGW,Thickest
ThickchicksGW,English fat ass
ThickchicksGW,am I fuckable?
ThickchicksGW,Big booty gf
TikThots,First 100 reactions all gets a nude
TikThots,Heavy on both ends
TikThots,Just turned 18 and still a bit shy about showing myself nude on the web... am i cute
TikThots,Just turned 18 and kinda new to posting here... do i fit in the club guys?
TikThots,hope you're into redheads with blue eyes and big tits
TikThots,just turned 18 and working on looking more sexy... how am i doing
TikThots,Just turned 18 and my boobs already have grown that much... are they too big for you?
TikThots,these are my two big reasons to get you hard
TikThots,Do i look like a slut in this… or like a good girl? [F18]
TikThots,First 100 reactions all gets a nude vids
TikThots,Just turned legal and my boobs won’t stop growing… are they too big for you?
TikThots,Just turned 18 but i’m already mature… can i show you how mature i am?
sluts,would u fuck me if I was your room mate?
sluts,who wants my juicy naturals all in their face?
sluts,Guess my size?
sluts,Just turned 18 and still cannot find a BF... is it because men don't like big boobs anymore?
sluts,my big titties need sucking
sluts,can i ride you all night?
sluts,Are my boobs too big for just turning 18… or they look fine to you?
sluts,"What's going in first, your tongue or your dick?"
sluts,I just guess I was born as one <3
sluts,wettest and tightest pussy you will ever find
sluts,how rough will you be with me?
sluts,Just turned 18 and the boys in highschool don't know what I'm hiding
hotclub,"If you had a chance to change one thing on my body, what would you change?"
hotclub,Are my boobies big enough for an 18yo?
hotclub,You can only choose one... My face or my boobs (18F)
hotclub,"I need a man's opinion, are you a pussy guy or an ass guy?"
hotclub,how hard will you spank me?
hotclub,Am I the kinda girl you’d dump your load in? 😝
hotclub,I want your hands all over me
hotclub,"Guys my age don't notice me, do older guys notice me?"
hotclub,Just turned 18 and the boys in school don't know what I'm hiding... should i let them find out
hotclub,I want you face in between these thick thighs
hotclub,Just turned 18 and never showed myself nude on the web before... am i still cute
hotclub,Imagine waking up to this every morning
UniversityGirls,I hope you like the taste of big white ass
UniversityGirls,Prepare to be smothered
UniversityGirls,My hot ass needs spanking
UniversityGirls,Think you can handle this big ass babe
UniversityGirls,How long will you last in my tight pussy
UniversityGirls,playing with myself for you
UniversityGirls,Just turned 18 and looking for love...
UniversityGirls,Think you can handle this pretty college slut
UniversityGirls,Just turned 18 and first time posting myself nude on the internet... do i fit in here?
UniversityGirls,Ready for you to fuck a baby into me ;)
UniversityGirls,Pretty in pink
UniversityGirls,Does a shaved pussy feel better for guys?
DressedAndUndressed,Exposed
DressedAndUndressed,MILF over 55
DressedAndUndressed,Playful
DressedAndUndressed,Naked always better
DressedAndUndressed,Bikini | Nude
DressedAndUndressed,Bikini | naked
DressedAndUndressed,Milf
DressedAndUndressed,Watch me get naked
DressedAndUndressed,In a dress or naked?
DressedAndUndressed,My two sides
DressedAndUndressed,Pick 1 based on face
DressedAndUndressed,cute vs slut
TikTok_Ass,@mayleereid compilation part 2
TikTok_Ass,@mayleereid compilation part 1
TikTok_Ass,@mayleereid
TikTok_Ass,@Jailyneojeda
TikTok_Ass,Left or right @ptwithally
TikTok_Ass,@thataspyn
TikTok_Ass,@itslindsaycapuano
TikTok_Ass,"@valeriakeler_oficiall 1,2, or 3"
TikTok_Ass,@oftyleridol
TikTok_Ass,@b.eleanor_
TikTok_Ass,@jumpyaida slo-mo 1/3
TikTok_Ass,@itzelpaeznavy
GirlsShapedLikeMewtwo,A quick peek at the physique ;)
GirlsShapedLikeMewtwo,On or off?
GirlsShapedLikeMewtwo,Perfect Persian body
GirlsShapedLikeMewtwo,"Cows are sacred animals, as am I"
GirlsShapedLikeMewtwo,Big booty persian
GirlsShapedLikeMewtwo,They don’t make bikinis for tits this big
GirlsShapedLikeMewtwo,almost thicker than mewtwo
GirlsShapedLikeMewtwo,Big booty brunette
GirlsShapedLikeMewtwo,Was MewTwo ever this thick?
GirlsShapedLikeMewtwo,Thicker than a Snicker
GirlsShapedLikeMewtwo,Hourglass body
GirlsShapedLikeMewtwo,just like mewtwo
SchoolgirlsXXX,can I be your new personal fuckdoll?
SchoolgirlsXXX,Do older guys like my bodytype? 18F
SchoolgirlsXXX,Just turned 18 and still very new to all this... am i cute
SchoolgirlsXXX,If you guess my age I will send you something special
SchoolgirlsXXX,1-10 how suckable do my naturals look?
SchoolgirlsXXX,Stacked latina
SchoolgirlsXXX,Just got back from class
SchoolgirlsXXX,can you eat me for breakfast?
SchoolgirlsXXX,Would you choose a girl with bigger boobs if you can fuck us both?
SchoolgirlsXXX,"Guys my age only seem to notice girls with big boobs, do older guys like me? 18F"
SchoolgirlsXXX,Do older guys like my bodytype? 18F
SchoolgirlsXXX,"Guys in school wonder if we did anything naughty together, only if they knew"
thatBounce,Meet me in the dressing room.. 🤫😇
thatBounce,Shaking my melons (;
thatBounce,Can't help but smiling about my bouncing
thatBounce,Bouncing that ass
thatBounce,Is this boob size qualify for a suck or a pass?
thatBounce,I have the bounciest pair of tits ☺
thatBounce,They are shaking so bouncy
thatBounce,"Dont be shy, you can give it a lick :)"
thatBounce,Could I wear this to the pool?
thatBounce,I hope your hands are big enough to be my bra replacement
thatBounce,They are frolicking so good inside my top
thatBounce,Would you like to see me bounce on you? 18F
TheOnesYouLustOver,It's pajama day at school. Is this something I should wear to class?
TheOnesYouLustOver,How do I get an older guys attention?
TheOnesYouLustOver,let me ride you all day everyday
TheOnesYouLustOver,Is my booty thick enough for a 4'9 latina? 18f
TheOnesYouLustOver,I wanna try with an older guy now that I'm 18
TheOnesYouLustOver,I want a cold beer and a hot dick
TheOnesYouLustOver,How do I get an older guy?
TheOnesYouLustOver,Can anyone help me get attention from older guys? 18F
TheOnesYouLustOver,What do I do to get an older guys attention?
TheOnesYouLustOver,Would you mind if my lifeguard uniform was a bit see-through?
TheOnesYouLustOver,can I be your personal fuckdoll?
TheOnesYouLustOver,Can I wear this around the house daddy? (18F)
SluttyMaterial,slutty maid from Ecuador looking for work
SluttyMaterial,who are you fucking first?
SluttyMaterial,do you like thick thighs here?
SluttyMaterial,daddy... can i fuck you like this?
SluttyMaterial,how long are you lasting? ;)
SluttyMaterial,Im such a slut on my breaks at work
SluttyMaterial,will you breed me or pull out?
SluttyMaterial,are my cute natural titties your type?
SluttyMaterial,isn't a fun idea to have a handjob under the table? or u prefer when i suck it instead of keeping it low
SluttyMaterial,cute or slutty...? [F18]
SluttyMaterial,i want to be someone's property
SluttyMaterial,will you fuck me outside the mall?
sensualcurves,Just showing off my tiny waist and wide hips. You should have your hands wrap around my waist and pound away!
sensualcurves,I love when you pinch them
sensualcurves,are my boobs big enough for you?
sensualcurves,Lick me from head to toe
sensualcurves,You can tell I have sexy curves even with clothes on
sensualcurves,I love wearing nothing but heels and a plug. It makes me feel so slutty.
sensualcurves,am i thick enough to be your fuckbuddy?
sensualcurves,Can boobs get too big? [F18]
sensualcurves,i doubt you'd last 2 minutes😝
sensualcurves,is this what you expected to be under my school uniform? [F18]
sensualcurves,Just turned 18 and still very new to this online nude thing... how am i doing
sensualcurves,will you skip gym class for me?
AmateurPorn,They are bit in your face
AmateurPorn,Determined to breed
AmateurPorn,I love knowing I caused that cumshot
AmateurPorn,I go to the office with no underwear on..
AmateurPorn,"If you had to choose: 1 hour of sex, or 20 minutes of BJ"
AmateurPorn,Nothing better than football and sex
AmateurPorn,Flashing my titties on the balcony
AmateurPorn,Skipping class to get my back blown out
AmateurPorn,Just turned 18 and my boobs won’t stop growing…
AmateurPorn,I was desperately trying to get fucked at the party
AmateurPorn,"Cowgirl > Doggystyle, yes or no"
AmateurPorn,I love the feeling of thick cock inside me
LegalTeensGW,"Dude just let me practice my deep-throating on you, your wife won’t find out"
LegalTeensGW,where are the middle aged guys who want to use my pussy?
LegalTeensGW,petite slut with a big cock addiction
LegalTeensGW,I want every last drop of the cum in your balls
LegalTeensGW,Coming back to haunt your feed
LegalTeensGW,Barely legal teen at your service
LegalTeensGW,Lets be friends and i'll let you breed me 4 times a day
LegalTeensGW,Use me like a little hijabi fleshlight
LegalTeensGW,Who here loves big natural tits?
LegalTeensGW,Who here loves natural tits?
LegalTeensGW,Left or right?
LegalTeensGW,Your pov before eating my pussy 😇
YoungGirlsGoneWild,"do men like shaved, trimmed, or bush 🐱"
YoungGirlsGoneWild,Just your average college teen trying to be hot for you
YoungGirlsGoneWild,Perfect breeding position x
YoungGirlsGoneWild,Pinkest pussy you've seen in awhile
YoungGirlsGoneWild,Tight young pussy
YoungGirlsGoneWild,"how I look when i'm ""bored"" before bed 😏"
YoungGirlsGoneWild,"my older brother's friends said i have a nice body, but i'm not sure. what do u think? complete stranger [f18]"
YoungGirlsGoneWild,Young Pakistani Pussy
YoungGirlsGoneWild,I've got a cure for your morning wood
YoungGirlsGoneWild,almost perfect for daddy
YoungGirlsGoneWild,At school no one knows I’m hiding all of this underneath
YoungGirlsGoneWild,pov: I ask you to wake me up from my nap and this is what you see 😏
AssHoleGW,quick question: may i send you more nudes? Y or N
AssHoleGW,If I was your wife how often would you fuck my ass?
AssHoleGW,What do you call a girl who offers anal on the 1st date?
AssHoleGW,It's our first date and I spread my cheeks. What you'll say?
AssHoleGW,put only 1 word to describe my ass hole
AssHoleGW,Will you make it drip in cum so I can lick it out after?
AssHoleGW,Which one of us will you eat first?
AssHoleGW,Kiss my asshole and make out with it
AssHoleGW,What do you call a 40 yo milf who offers anal every date?
AssHoleGW,Can you taste both our assholes and tell us if they taste the same?
AssHoleGW,"My fingers barely fit, could you?"
AssHoleGW,Quick question: may i send you more nudes? Y or N
DegradingHoles,"You can use either hole, as long as you end up filling them with your cum 🥵"
DegradingHoles,My type is a man who fuck ass on the first date
DegradingHoles,choose any hole you want
DegradingHoles,my holes should be perfectly eaten
DegradingHoles,My type is an older guy who fuck my ass on the first date
DegradingHoles,Use me until i can't walk straight
DegradingHoles,I love it when guys treat my holes like useable objects
DegradingHoles,"borrow my holes whenever, it makes me so horny"
DegradingHoles,Both holes are available for you
DegradingHoles,Cant wait to feel your bone inside me
DegradingHoles,Take a look to my deeps tight holes
DegradingHoles,i need both holes filled
18F,every yes gets a nudies from me instantly [18F]
18F,every YES gets a sex vid instantly [18F]
18F,"sending nudes to random men today, are u in? [18F]"
18F,"i'm sending nudes to random men today, who's up for it? [18F]"
18F,every yes gets a nude instantly [18F]
18F,Do I get a private dick pic if I send you this? [18f]
18F,every hi gets a nude instantly [18F]
18F,"just drop ur age and gets a chance to fuck me, try me 👀👇 [18F]"
18F,every yes gets a sex vid instantly [18F]
18F,every yes gets a nude instantly [18F]
18F,"Sending nudes to random men today, who's in? (18f)"
18F,Would you like an 18f to be virgin when you fuck her?
18_19,2005 goth girl.. dtf?
18_19,Are we still fucking even if I have petite tits
18_19,Some fresh 18 natural boobs
18_19,A 19yo French girl
18_19,Everyone says that Ukrainian girls are the most beautiful
18_19,A busty 18-year-old girl with a perfect waistline
18_19,How deep do you think you could fit in my little 89lbs body?
18_19,Newly 18yrs old and Australian
18_19,Perky and pink boobs
18_19,I'm 19 and still have literally no boobs
18_19,Good morning to the men who like natural boobs
18_19,Busty 18 latina just waking up
collegensfw,should i stay in bed and have u as a company or go to the gym
collegensfw,i always feel like touching myself at work..
collegensfw,my professor tells me how wet i make him
collegensfw,I love showing the pink that is hiding underneath my pussy lips and I know you love that too!
collegensfw,the thought of older men watching me drives me crazy
collegensfw,the thought of older men watching me drives me crazy
collegensfw,would watching a movie on netflix w me instead go on your things to do list
collegensfw,i'm the type of girl to sleep with my professors to pass the exam
collegensfw,We want the cum of a man who has never been with a black girl!
collegensfw,Your Japanese slutty student
collegensfw,Your favorite college babe
collegensfw,Teasing you after class
HornyAmateurGirls,Hit it raw or pass it to the homie
HornyAmateurGirls,Not the smoothest ride but I’m getting the job done
HornyAmateurGirls,When I wear no panties I get my shorts all wet
HornyAmateurGirls,Should I wear these leggings to the gym
HornyAmateurGirls,Teacher’s are extra horny on weekends
HornyAmateurGirls,look at my fat pussy stuffed in my sheer panties
HornyAmateurGirls,bending over so you can fuck my fat pussy
HornyAmateurGirls,I'm always needing my pussy played with
HornyAmateurGirls,My husband finally agreed to share me with other men
HornyAmateurGirls,Horny and home alone
HornyAmateurGirls,What will we do if someone catches us
HornyAmateurGirls,is my camel toe embarrassing
LegalTeens,Are 18yr old redheads like me a turn on or turn off
LegalTeens,"Petite 18yo teen, are we fucking or nah?"
LegalTeens,I’m a 5ft church girl who prefers being shaved..should I keep it this way
LegalTeens,Tell me yes and ill send you my nudes
LegalTeens,Tell me yes and ill send you my nudes
LegalTeens,bestfriend and I :)
LegalTeens,Imagining you makes me rub my clit
LegalTeens,How deep do you think you could fit in my little 90lbs body?
LegalTeens,Staked slut born in 2006 is down to fuck ;)
LegalTeens,Tell me yes and ill send you my nudes
LegalTeens,"if ur inbox is open to nudies, say yes"
LegalTeens,How deep do you think you could fit in my little 88lbs body? 😇
CollegeAmateurs,Say one word about my body
CollegeAmateurs,Straight to the goods
CollegeAmateurs,Is it bedtime yet
CollegeAmateurs,My progress since last year :) 23F
CollegeAmateurs,Freshly shaved
CollegeAmateurs,Delivering the daily dose of perky tits
CollegeAmateurs,The clothes look better on the floor..
CollegeAmateurs,"Cute face, big boobs"
CollegeAmateurs,I never wear panties under my skirt. I love when there is easy access to my holes!
CollegeAmateurs,Riding around with the girls out
CollegeAmateurs,Say the first word that comes to mind when you see my body
CollegeAmateurs,Everyone can appreciate drive thru titties
palebeauties,Felt cute :)
palebeauties,Would you spend the weekend with me?
palebeauties,Pasty legs 🙃
palebeauties,Got a little sun ☀️
palebeauties,I liked my outfit today :)
palebeauties,Woke up pale again
palebeauties,Would you say hi to me?
palebeauties,Would you give a kiss?
palebeauties,Am I girlfriend material ?
palebeauties,Would you give me a kiss?
palebeauties,Almost 33 years old and still single... not sure if anyone would date me anymore
palebeauties,"26 yrs old, single and never married. Any problem?"
RateMyNudeBody,be brutally honest 🙈 29 (f)
RateMyNudeBody,Just turned 30. (F)irst post ever.
RateMyNudeBody,"After gym, rate me ;) (f) 22"
RateMyNudeBody,Always curious about what people would think of my naked body. (F)
RateMyNudeBody,19(f) thoughts on my petite body?
RateMyNudeBody,So… rate my nude body (F)
RateMyNudeBody,(F) 23. What do you think of my body?
RateMyNudeBody,24(f) Should I get implants?
RateMyNudeBody,19(F) 5’1 / 100lbs - be honest 🥰
RateMyNudeBody,Rate me. I know I need to hit the gym more (f)
RateMyNudeBody,Rate me <3 (f)
RateMyNudeBody,Does anybody like my body if i'm just standing up? 22(F)
beautifulbutt,Ill let you fuck both holes as long as you promise to cum in my ass
beautifulbutt,Who wants to eat it?
beautifulbutt,Can you rub my ass for me?
beautifulbutt,What would you rate my butt?
beautifulbutt,Do you think my butt is beautiful?
beautifulbutt,Can you spank my butt real hard? ;)
beautifulbutt,would you fuck this ass raw?
beautifulbutt,Say HI if you’re a real ass eater!
beautifulbutt,Wanna take a bite or the whole cake
beautifulbutt,Would u cheat on ur wife with me?
beautifulbutt,Can you put cum on my ass?
beautifulbutt,These are a little snug!
Naked,"Pale and horny me, I hope you can lick well"
Naked,Just mirroring my tanned body
Naked,Spreading my holes for you
Naked,"In case you didn't get a nude from your woman today, here's mine"
Naked,My perfect body looks better completely naked
Naked,"My neighbor told me I have the best tits he's ever seen, is he exaggerating?"
Naked,No condoms allowed. Are you taking the chance?
Naked,Where are you cumming?
Naked,Just in need to be used by a random man
Naked,"My titts have the perfect shape, don't you think"
Naked,I think my naked body turns you on
Naked,This body need your attention tonight
CamSluts,if i beg you can you not pull out?
CamSluts,my titties were made for sucking
CamSluts,how would you describe my texan booty?
CamSluts,would you take me raw on the first date?
CamSluts,do you prefer natural or fake tits?
CamSluts,How do I get an older guy to notice me?
CamSluts,Do guys think my bodytype is sexy?
CamSluts,can i be your new personal slut?
CamSluts,Ever fuck a busty texan girl?
CamSluts,Your favorite thick cam slut
CamSluts,Are older guys into 18 y/o e-girls?
CamSluts,My parents would kill me if they found out i post on reddit... but i am so happy about all the compliments i receive! [F18]
Gonewild18,have u ever fucked an 19 petite girl before?
Gonewild18,"if ur inbox is open to nudies, say yes"
Gonewild18,"if ur inbox is open to nudies, say yes"
Gonewild18,Do you always eat pussy before fucking? ;)
Gonewild18,"Good girls go to heaven, bad girls make you feel like heaven"
Gonewild18,Just say “hey” and I will send you smth🩷
Gonewild18,I think 19 is a good time to try our first 3some
Gonewild18,"I'll send u my secret pics only if u jerk off to them, deal?"
Gonewild18,"if ur inbox is open to nudies and you'll jerk em off, say hi"
Gonewild18,"if ur inbox is open to nudies, say yes"
Gonewild18,"If your inbox is open for nudes, say YES"
Gonewild18,my teen titties were born to be sucked
AsiansGoneWild,Would you dump your load in an ass like mine?
AsiansGoneWild,Do you like my traditional thai outfit? (minus actual clothes😅)
AsiansGoneWild,I taste good i promise
AsiansGoneWild,Are slimthick Koreans your type?🍑
AsiansGoneWild,I practice this to do it on your face
AsiansGoneWild,My nipple are hard as wood
AsiansGoneWild,Wake up! There's a pussy to eat!
AsiansGoneWild,Ready to lick my abs? You can go to my pussy too
AsiansGoneWild,What can you feel when you see this?
AsiansGoneWild,Let’s swap noodz
AsiansGoneWild,Do men here have a thing for Filipina moms too✌️36F
AsiansGoneWild,Would you go in raw or with a condom?
NSFWNextDoorGirls,is it bad i fantasize about older men?
NSFWNextDoorGirls,would u kiss me if i sent u nudes?
NSFWNextDoorGirls,"I wanna send nudes to random men, leave a ❤️ if you're game"
NSFWNextDoorGirls,Guess my size and your mine
NSFWNextDoorGirls,To the men that love small tits.. I love you more than you love me!
NSFWNextDoorGirls,Just turned 18 and still cannot find a BF… do you think it is because i’m only 4’9 small?
NSFWNextDoorGirls,Just turned 18 and my boobs won’t stop growing… are they too big? [F18]
NSFWNextDoorGirls,Just turned 18 and still a bit shy about showing my body on here... am i cute
NSFWNextDoorGirls,18 yo boobs have grown so much that the bra is getting tight… should i just take it off?
NSFWNextDoorGirls,Just turned 18 and the girls in school are still calling my but small... is it really that small
NSFWNextDoorGirls,Just turned 18 but i’m already mature… can i show you how mature i am?
NSFWNextDoorGirls,Will you take the risk of fucking my ass 7days a week?
thiccerthanyouthought,Do I hide it well or not? I think I do but maybe I'm delusional
thiccerthanyouthought,too hot to handle
thiccerthanyouthought,the thicker the better right
thiccerthanyouthought,Have I deceived you (;
thiccerthanyouthought,Let me show you my secret weapon to drain you…
thiccerthanyouthought,cum slap this thick ass teacher with that dick
thiccerthanyouthought,Did the size surprise you ?
thiccerthanyouthought,Surprise surprise (;
thiccerthanyouthought,Made to smother you with
thiccerthanyouthought,Nurse booty is getting bigger ;)
thiccerthanyouthought,wonder why people let me go in front of them in lines regularly
thiccerthanyouthought,Its time for me to milk you
happy_nsfw,"if that wont make you happy, what else will?"
happy_nsfw,"big smile, big lips and a small body!"
happy_nsfw,would you slap my cute little butt?
happy_nsfw,how happy could this type of body make you?!
happy_nsfw,Perfect body for fucking
happy_nsfw,happy when you join me
happy_nsfw,can we fuck?
happy_nsfw,nothing beats a hot shower! (with me)
happy_nsfw,Can I be your happy place ?
happy_nsfw,"Thinking about your dick, I don't notice myself taking off my shorts"
happy_nsfw,"You can get me a little wet, I don't mind"
happy_nsfw,Doing a survey to see how many men like tiny tits :)
18_22,Be honest.. are pale girls like me sexy or just average [F18]
18_22,DTF ME?
18_22,Just turned 18 and the girls in school still call my butt small... is it really that small
18_22,is it even humanly possible to say no to me?
18_22,"If I told you I'm a virgin, what's your reaction?"
18_22,are you breeding my pussy or ass first?
18_22,would u show me off to ur friends or keep me as ur dirty little secret?
18_22,just turned 18 and the won't stop growing... am i still cute
18_22,boys always tell me they are just too big for my age
18_22,I think daddy will be mad if i wear this to his birthday party... [F18]
18_22,Just turned 18 and my boobs finally started to grow… how are they looking?
18_22,since this morning i can finally post in this subreddit
LegalTeens_,Just turned 18 but i’m already mature… can i show you how mature i am?
LegalTeens_,Just turned 18 and still very new to this online nude thing... am i cute
LegalTeens_,Just turned 18 and never really shown myself nude on the web before... am i cute
LegalTeens_,Would you play with my boobs even tho i’m only 4’9 small? [F18]
LegalTeens_,Just turned 18 and my boobs won't stop growing... do guys still like them big?
LegalTeens_,Do you think I could be a good help for your morning problem?
LegalTeens_,Are my boobs too big for just turning 18… or they look fine to you?
LegalTeens_,Looking for someone brave to fuck me in the sea <3
LegalTeens_,Just turned 18 and the boys in highschool don't know what I'm hiding....
LegalTeens_,is it true that guys my age prefer skinny girls over someone w curves like me
LegalTeens_,Just turned 18 and my boobs won't stop growing... did you expect them to be that big?
LegalTeens_,Hope you have a wonderful start into the weekend <3
needyass,some guy once said my ass is too flat...
needyass,will this cute little butt satisfy you?
needyass,"my first date is about to come over, how is my outfit?"
needyass,A perfect shaped ass
needyass,Too small ass?😅
needyass,"beautiful chocolate buns, need some kind of filling for them"
needyass,This ass is begging for your load
needyass,My Curvy Soapy Ass Is Waiting For You
needyass,My Curvy Oiled Ass Is Waiting For You
needyass,Help me stretch it :)
needyass,Should i even try to sit on ur face?
needyass,I'm such a horny slut
1819gw,"18yo,shy and nerdy and asian. is it a turn off?"
1819gw,Would you do it with me right after school?
1819gw,just turned 18 and showing myself nude on the web for the first time... am i cute
1819gw,Anyone here in to nurses?
1819gw,Guess I should do my homework rn lol <3
1819gw,Just turned 18 and still 4'9 little... atleast my boobs are kinda big?
1819gw,"Don't worry, I'll help you when the pressure gets too hard <3"
1819gw,Would you be brave enough to do it with me while my parents are next doo?
1819gw,Just turned 18 and my boobs finally started to grow… how are they looking?
1819gw,cum on my face or cum on my ass?
1819gw,How long do you think I would need? <3
1819gw,Would you take a bath with me? (F19)
YoungBabes,Do you like the pigtails daddy :)
YoungBabes,How fast would you take these off my 18yo body?
YoungBabes,Does my small 18yo body make you hard?
YoungBabes,is 19 y/o too young for you?
YoungBabes,do i get private dick pics if I sent you this?
YoungBabes,would you fuck this bods?
YoungBabes,ready to ride babe?????????
YoungBabes,lets have some fun together :)
YoungBabes,18F perfect or too young?
YoungBabes,Think this nurse body is the right medicine for you?
YoungBabes,I got the front and the back
YoungBabes,Some patients say they are not thick enough for them.. are they thick enough for you?
paag,Hungry?
paag,I need a creampie
