Subreddit,Caption
amihot,What word pops into your head when you see me (F25)
amihot,Close to 30 but I still feel hot 🥹 f28
amihot,Y or N? 18F
amihot,"I'm a school teacher, honest opinions please F24"
amihot,Would you say I'm average or hot for a F19?
amihot,Question for the older guys: am I hot enough to make you hard? 20F
amihot,Would you say I'm average or hot for a F19?
amihot,Question for the older guys: am I hot enough to make you hard? 20F
amihot,Y or N? F18
amihot,What your first thoughts (F18)
amihotaf,"37F single mom ""Am I hot?"" I know it's not 'spicy' but I'm just here for friendship and kind words."
amihotaf,Would you say I'm hot? [F26]
amihotaf,"F37 be honest, how do I look?"
amihotaf,Do I look hot on my red outfit? F26
amihotaf,Am I hot?
amihotaf,be honest am i cute f18
amihotaf,F 34 am I hot or what
amihotaf,Am i hot? 18F
amihotaf,what is your honest thoughts
amihotaf,"I'm curious, what are your honest thoughts? f18"
amihotsfw,"be honest, am i hot f19"
amihotsfw,am i hot? f19 be honest please
amihotsfw,Are 18 year old hot? (F18)
amihotsfw,Are 18 year olds hot? (F18)
amihotsfw,Am i hot? F18
amihotsfw,Are 18 year old hot? (F18)
amihotsfw,am i hot? f18 be honest please
amihotsfw,got heartbroken. tell me 1 word to cheer me up f19
amihotsfw,(F18) not sure if I give off hot or cute?
amihotsfw,Would you?
whitecheeks,"If you’re an ass guy, does mine look tasty to you"
whitecheeks,If you are brave enough you gonna eat that ass on the first date
whitecheeks,Are you an ass or a pussy guy
whitecheeks,backshots will sound crazy
whitecheeks,"If you’re an ass guy, does mine look tasty to you"
whitecheeks,Is my ass one you’d nut in...Or are you too shy
whitecheeks,Is my ass one you’d nut in...Or are you too shy
whitecheeks,Jiggle jiggle
whitecheeks,If you are brave enough you gonna eat that ass on the first date
whitecheeks,"just one rule, tongue first, cock after"
faces,My face after a new hair cut
faces,The face of a girl that will finally have a vacation tomorrow! [f22]
faces,The face of a cutie little girl
faces,The face of a girl who's not ready to stop hibernating in winter
faces,The face of a single pretty girl
faces,The face of a girl that finally has a day off today! [f22]
faces,Face of a girl that just turned 18
faces,Just my no makeup face
faces,Face of a girl who loves her Wednesdays off :)
faces,The face of a woman who is 45 today
tight_shorts,"So tight, it's like they're painted on"
tight_shorts,they hug my booty so well
tight_shorts,this is how my tight shorts look after a workout
tight_shorts,My tight lil sleep shorts 😉😊
tight_shorts,i’m going to wear them on our dates
tight_shorts,The tighter the better
tight_shorts,these shorts hug my curves perfectly
tight_shorts,Nike pro
tight_shorts,It’s juicy from the back
tight_shorts,Cheeks are bursting out these shorts
bootyshorts,I like my booty shorts real tight and real high
bootyshorts,it's always a tight squeeze
bootyshorts,i love pulling them up so they cover even less of my ass
bootyshorts,It's like they're painted on
bootyshorts,I like 'em real tight and pulled up real high
bootyshorts,These cheeks are bursting out
bootyshorts,my ass is outgrowing these jean shorts
bootyshorts,I know you will enjoy this position
bootyshorts,Back it up
bootyshorts,These shorts are barely holding in all this ass
gympawg,Just a mom in the gym keeping the guys motivated
gympawg,I love seeing guys half my age checking me out in the gym (42f)
gympawg,"never knew at 42 I'll be making guys at the gym stare, but I'm lovin' it"
gympawg,turning more heads at 42 than I ever did at 24
gympawg,Would you take a double look if you saw my Milf body walking thru the gym?
gympawg,I'm that mom that always brings cake to the gym
gympawg,Progress checkkk
gympawg,Green pump check! 💚🍑
gympawg,Wow! This Albanian PAWG has a HUGE bubble butt 🇦🇱🤤🍑
gympawg,sometimes I wonder if any of the regular guys I see at the gym have ever jerked off to my ass??
faceratings,"38F honestly, I just want to feel seen."
faceratings,Dieser Hammerkredit ist rekordverdächtig - So zahlen Sie fast nichts. 🏆 Exklusives online Kreditangebot bei smava.de
faceratings,F29 should I tone down my smile? Rate me please
faceratings,Rate me! F37
faceratings,"Rate my face, I'm old so c'mon man 46F"
faceratings,Honestly Rate Me?! [f22]
faceratings,Rate my face ? F29
faceratings,"F20, please be extra gentle rating my face 🥺"
faceratings,36F rate me plz
faceratings,F26 what do you think?
irlgirls,We have a winner (IUTR)
irlgirls,Nice uhh... Mountains. iutr
irlgirls,Mirror IUTR
irlgirls,Views😍[IUTR]
irlgirls,Love the necklace IUTR
irlgirls,iutr gym selfie
irlgirls,IUTR
irlgirls,IUTR college freshmen
irlgirls,Iutr
irlgirls,Summer memories IUTR
gymgirlssfw,this is what my outfit is after the gym :)
gymgirlssfw,always flexing :)
gymgirlssfw,Another day another leg day
gymgirlssfw,"Doing my workouts seriously, do I look good?"
gymgirlssfw,About to go for a run :))
gymgirlssfw,"everyone tells me I have an ass that talks, but in my opinion it could be improved, what do you think?"
gymgirlssfw,Most guys are afraid of my right hook
gymgirlssfw,I never skip glutes day
gymgirlssfw,Today’s training🍑🍑🍑
gymgirlssfw,Going for a workout today ;)
gymgirls,sister titties after workout :)
gymgirls,Say one word about my ass
gymgirls,Hard work paid off
gymgirls,Why will hot guys check me out but never come say hi!?
gymgirls,Are veins like this attractive to men? 😌
gymgirls,Your 2024 gym crush
gymgirls,Would you notice me at the gym? :)
gymgirls,The gym bathroom is my favorite place to be a slut :)
gymgirls,What part of my body is most impressive?
gymgirls,Say one word about my ass
thickfit,Nikita Simpson
thickfit,Pull ups
thickfit,"Yup, she squats"
thickfit,Best Nike add ever
thickfit,Staying Focused all 2024
thickfit,K_banesa
thickfit,3 yrs transformation.
thickfit,Haleigh Cox
thickfit,Those kickbacks are fire thou
thickfit,Kelly Matthews
gymgirlsnsfw,10 months into the gym :)
gymgirlsnsfw,I hope we can all agree that a strong bush compliments a strong body
gymgirlsnsfw,I hope that my hard work makes you hard
gymgirlsnsfw,"19yo and 5'... Sending nudes to random men today, who's in"
gymgirlsnsfw,I hope that my hard work makes you hard
gymgirlsnsfw,What’s your honest opinion on my shape?
gymgirlsnsfw,What do you call a girl that fantasizes about being fucked in the gym? In front of everyone..
gymgirlsnsfw,What do you think of my physique?
gymgirlsnsfw,'Train' with me?
gymgirlsnsfw,Muscles aren't just for men :)
clothedcurves,The perfect jeans don’t exi-
clothedcurves,feeling super sexy in simple jeans and shirt
clothedcurves,Thick girls in sundresses >>>
clothedcurves,do you like a girl in blue jeans?
clothedcurves,Do you like bright swimsuits?
clothedcurves,Milf on campus
clothedcurves,My dress looks painted on ;)
clothedcurves,Just turned 18 and still 4'9 small
clothedcurves,i love how these leggings look from the back
clothedcurves,It's my birthday and I'm feeling like sharing
makemefeelgood,"F29, what do y'all think"
makemefeelgood,I don't know what to do with this feeling 😔
makemefeelgood,feeling cute today tell me what you think :)
makemefeelgood,React and you'll be amazed🤩
makemefeelgood,My music lessons were really tiring today.. I need some uplifting words!
makemefeelgood,I wish you took me home
makemefeelgood,Wish you all the best for 2024 ✨
makemefeelgood,I need your kind words today I'm feeling sad
makemefeelgood,I want to feel good and not feel bad
makemefeelgood,"I turned 36 yesterday, make me feel better…"
widehipsnsfw,use my hips like doggy style grips
widehipsnsfw,Natural child bearing hips
widehipsnsfw,Big hips and tits on top
widehipsnsfw,Soft hips to make your cock hard
widehipsnsfw,just hold my hips while you bury your face in my cheeks ☺️
widehipsnsfw,Does my hips look better from the front or back?
widehipsnsfw,These jeans hug my hips in allll the right places!!
widehipsnsfw,Wide hips and jiggly cheeks
widehipsnsfw,i want to hypnotize you with my hips
widehipsnsfw,Describe my hips in one word!
slightcellulite,Time to embrace my fat ass in all it’s cellulite glory
slightcellulite,Embracing my big booty more and more.
slightcellulite,i have some homemade cake for you to taste
slightcellulite,I think the cellulite makes it look even better
slightcellulite,I think I look pretty even with cellulite
slightcellulite,These dimples aren’t on my face but I think they’d look pretty good on yours
slightcellulite,Thick in all the right places (f)
slightcellulite,I think I'm going to like it here.
slightcellulite,Curvy mom bod (f) with a phat butt
slightcellulite,Curvy mama with a phat butt (f)
onlyfaces,Are you turned on by me? F18
onlyfaces,Face of a new friend
onlyfaces,Feeling pretty
onlyfaces,Are you turned on by me? F18
onlyfaces,Does anyone appreciate a cutie
onlyfaces,A charming face always brightens the day
onlyfaces,What caught your attention first? Tell the truth.
onlyfaces,Are you turned on by me? F18
onlyfaces,A charming face always brightens the day
onlyfaces,Am I turning you on? F18
